title,abstract,authors,keywords,affiliations,month,link,journal_name,year,volume,issue
Realization utility,"A number of authors have suggested that investors derive utility from realizing gains and losses on assets that they own. We present a model of this “realization utility,” analyze its predictions, and show that it can shed light on a number of puzzling facts. These include the disposition effect, the poor trading performance of individual investors, the higher volume of trade in rising markets, the effect of historical highs on the propensity to sell, the individual investor preference for volatile stocks, the low average return of volatile stocks, and the heavy trading associated with highly valued assets.","['Nicholas Barberis', 'Wei Xiong']","['Behavioral finance', 'Disposition effect', 'Trading', 'Individual investors']",[],May,https://www.sciencedirect.com//science/article/pii/S0304405X11002376,Journal of Financial Economics,2012,104,2
Difference in interim performance and risk taking with short-sale constraints,"Absent much theory, empirical works often rely on the following informal reasoning when looking for evidence of a mutual fund tournament: If there is a tournament, interim winners have incentives to decrease their portfolio volatility as they attempt to protect their lead, while interim losers are expected to increase their volatility so as to catch up with winners. We consider a rational model of a mutual fund tournament in the presence of short-sale constraints and find the opposite: Interim winners choose more volatile portfolios in equilibrium than interim losers. Several empirical works present evidence consistent with our model. However, based on the above informal argument, they appear to conclude against the tournament behavior. We argue that this conclusion is unwarranted. We also demonstrate that tournament incentives lead to differences in interim performance for otherwise identical managers and that mid-year trading volume is inversely related to mid-year stock return.","['Suleyman Basak', 'Dmitry Makarov']","['Mutual fund tournament', 'Risk-taking incentives', 'Relative performance', 'Portfolio choice', 'Short-sale constraints']",[],February,https://www.sciencedirect.com//science/article/pii/S0304405X11002200,Journal of Financial Economics,2012,103,2
‘Déjà vol’: Predictive regressions for aggregate stock market volatility using macroeconomic variables,"Aggregate stock return volatility is both persistent and countercyclical. This paper tests whether it is possible to improve volatility forecasts at monthly and quarterly horizons by conditioning on additional macroeconomic variables. I find that several variables related to macroeconomic uncertainty, time-varying expected stock returns, and credit conditions Granger cause volatility. It is more difficult to find evidence that forecasts exploiting macroeconomic variables outperform a univariate benchmark out-of-sample. The most successful approaches involve simple combinations of individual forecasts. Predictive power associated with macroeconomic variables appears to concentrate around the onset of recessions.",['Bradley S. Paye'],"['Conditional volatility', 'Realized volatility', 'Granger causality', 'Forecast evaluation', 'Forecast combination']",[],December,https://www.sciencedirect.com//science/article/pii/S0304405X12001316,Journal of Financial Economics,2012,106,3
The cost and timing of financial distress,"Assessments of the trade-off theory have typically compared the present value of tax benefits to the present value of bankruptcy costs. We verify that this comparison overwhelmingly favors tax benefits, suggesting that firms are under-leveraged. However, when we allow firms to experience even modest (e.g., 1–2% annualized) financial distress costs prior to bankruptcy, the cumulative present value of such costs can easily offset the tax benefits.","['Redouane Elkamhi', 'Jan Ericsson', 'Christopher A. Parsons']","['Trade off theory', 'Financial distress', 'Debt-equity holder conflicts', 'Tax benefits', 'Financial leverage']",[],July,https://www.sciencedirect.com//science/article/pii/S0304405X12000232,Journal of Financial Economics,2012,105,1
Multifactor models and their consistency with the ICAPM,"Can any multifactor model be interpreted as a variant of the Intertemporal CAPM (ICAPM)? The ICAPM places restrictions on time-series and cross-sectional behavior of state variables and factors. If a state variable forecasts positive (negative) changes in investment opportunities in time-series regressions, its innovation should earn a positive (negative) risk price in the cross-sectional test of the respective multifactor model. Second, the market (covariance) price of risk must be economically plausible as an estimate of the coefficient of relative risk aversion (RRA). We apply our ICAPM criteria to eight popular multifactor models and the results show that most models do not satisfy the ICAPM restrictions. Specifically, the “hedging” risk prices have the wrong sign and the estimates of RRA are not economically plausible. Overall, the Fama and French (1993) and Carhart (1997) models perform the best in consistently meeting the ICAPM restrictions. The remaining models, which represent some of the most relevant examples presented in the empirical asset pricing literature, can still empirically explain the size, value, and momentum anomalies, but they are generally inconsistent with the ICAPM.","['Paulo Maio', 'Pedro Santa-Clara']","['Asset pricing models', 'Intertemporal CAPM', 'Predictability of stock returns', 'Cross-section of stock returns', 'Value and momentum']",[],December,https://www.sciencedirect.com//science/article/pii/S0304405X12001511,Journal of Financial Economics,2012,106,3
Seeking safety: The relation between CEO inside debt holdings and the riskiness of firm investment and financial policies,"CEO inside debt holdings (pension benefits and deferred compensation) are generally unsecured and unfunded liabilities of the firm. Because these characteristics of inside debt expose the CEO to default risk similar to that faced by outside creditors, theory predicts that CEOs with large inside debt holdings will display lower levels of risk-seeking behavior (Jensen and Meckling, 1976). Consistent with the theoretical predictions, we find a negative association between CEO inside debt holdings and the volatility of future firm stock returns, R&D expenditures, and financial leverage, and a positive association between CEO inside debt holdings and the extent of diversification and asset liquidity. Collectively, our results provide empirical evidence suggesting that CEOs with large inside debt holdings prefer investment and financial policies that are less risky.","['Cory A. Cassell', 'Shawn X. Huang', 'Juan Manuel Sanchez', 'Michael D. Stuart']","['Inside debt', 'Pensions', 'Deferred compensation', 'CEO incentives', 'Risk-seeking behavior']",[],March,https://www.sciencedirect.com//science/article/pii/S0304405X11002406,Journal of Financial Economics,2012,103,3
Optimal clearing arrangements for financial trades,"Clearinghouses support financial trades by keeping records of transactions and by providing liquidity through short-term credit that participants clear periodically. We study efficient clearing arrangements for exchanges, where traders must clear with a clearinghouse, and for over-the-counter (OTC) markets, where traders can clear bilaterally. When clearing is costly, it can be efficient to subsidize OTC clearing by charging a higher clearing price for transactions conducted on exchanges. The clearinghouse then operates across both markets. Since clearinghouses offer credit, intertemporal incentives are needed to ensure settlement. When liquidity costs increase, concerns about default lead to a tightening of liquidity provision.","['Thorsten Koeppl', 'Cyril Monnet', 'Ted Temzelides']","['Clearing', 'OTC vs. exchanges', 'Private information', 'Liquidity costs', 'Default']",[],January,https://www.sciencedirect.com//science/article/pii/S0304405X11001917,Journal of Financial Economics,2012,103,1
"Stock option vesting conditions, CEO turnover, and myopic investment","Corporations have been criticized for providing executives with excessive incentives to focus on short-term performance. This paper shows that investment in short-term projects has beneficial effects in that it provides early feedback about Chief Executive Officer (CEO) talent, which leads to more efficient replacement decisions. Due to the threat of CEO turnover, the optimal design of stock option vesting conditions in executive compensation is more subtle than conventional views suggest. For example, I show that long vesting periods can backfire and induce excessive short-term investments. The study generates new empirical predictions regarding the determinants and impacts of stock option vesting terms in optimal contracting.",['Volker Laux'],"['Executive pay', 'Stock option vesting', 'Managerial myopia', 'CEO turnover']",[],December,https://www.sciencedirect.com//science/article/pii/S0304405X12001183,Journal of Financial Economics,2012,106,3
Counterparty credit risk and the credit default swap market,"Counterparty credit risk has become one of the highest-profile risks facing participants in the financial markets. Despite this, relatively little is known about how counterparty credit risk is actually priced. We examine this issue using an extensive proprietary data set of contemporaneous CDS transaction prices and quotes by 14 different CDS dealers selling credit protection on the same underlying firm. This unique cross-sectional data set allows us to identify directly how dealers' credit risk affects the prices of these controversial credit derivatives. We find that counterparty credit risk is priced in the CDS market. The magnitude of the effect, however, is vanishingly small and is consistent with a market structure in which participants require collateralization of swap liabilities by counterparties.","['Navneet Arora', 'Priyank Gandhi', 'Francis A. Longstaff']","['Counterparty credit risk', 'Credit default swaps', 'Collateralization']",[],February,https://www.sciencedirect.com//science/article/pii/S0304405X11002327,Journal of Financial Economics,2012,103,2
What does futures market interest tell us about the macroeconomy and asset prices?,"Economists have traditionally viewed futures prices as fully informative about future economic activity and asset prices. We argue that open interest could be more informative than futures prices in the presence of hedging demand and limited risk absorption capacity in futures markets. We find that movements in open interest are highly pro-cyclical, correlated with both macroeconomic activity and movements in asset prices. Movements in commodity market interest predict commodity returns, bond returns, and movements in the short rate even after controlling for other known predictors. To a lesser degree, movements in open interest predict returns in currency, bond, and stock markets.","['Harrison Hong', 'Motohiro Yogo']","['Bonds', 'Business cycle', 'Commodities', 'Currencies', 'Futures market', 'Inflation']",[],September,https://www.sciencedirect.com//science/article/pii/S0304405X12000657,Journal of Financial Economics,2012,105,3
Profitability and capital structure: Evidence from import penetration,"Firms experiencing increases in import competition significantly reduce their leverage ratios by issuing equity and selling assets to repay debt. Using import tariffs and foreign exchange rates as instrumental variables for import penetration, I show that these results are not manifestations of endogenous relations between import competition and leverage. The results are consistent with traditional trade-off models of capital structure that predict a positive relation between book leverage and expected future profitability. Further evidence suggests that import competition affects leverage through changes in the trade-off between the tax benefits of debt and the costs of financial distress.",['Jin Xu'],"['Expected profitability', 'Leverage', 'Import competition']",[],November,https://www.sciencedirect.com//science/article/pii/S0304405X12000979,Journal of Financial Economics,2012,106,2
Hedge funds as liquidity providers: Evidence from the Lehman bankruptcy,"Hedge funds using Lehman as prime broker faced a decline in funding liquidity after the September 15, 2008 bankruptcy. We find that stocks held by these Lehman-connected funds experienced greater declines in market liquidity following the bankruptcy than other stocks; the effect was larger for ex ante illiquid stocks and persisted into the beginning of 2009. We find no similar effects surrounding the Bear Stearns failure, suggesting that disruptions surrounding bankruptcy explain the liquidity effects. We conclude that shocks to traders' funding liquidity reduce the market liquidity of the assets that they trade.","['George O. Aragon', 'Philip E. Strahan']","['Hedge fund', 'Market and funding liquidity']",[],March,https://www.sciencedirect.com//science/article/pii/S0304405X11002364,Journal of Financial Economics,2012,103,3
"Entrepreneurial risk, investment, and innovation","I estimate the effect of uncertainty on risky innovation using a panel of 11,417 manufacturing firms. I find that an increase in uncertainty has a large negative effect on the risky innovation of entrepreneurial firms, while it does not have any significant impact on other firms. This negative effect is stronger for the less diversified entrepreneurial firms in the sample. The estimation results are consistent with the innovation dynamics generated in a model in which entrepreneurs are risk averse and cannot diversify the risk of their business.",['Andrea Caggese'],"['Precautionary saving', 'Entrepreneurial risk', 'Uncertainty', 'Innovation']",[],November,https://www.sciencedirect.com//science/article/pii/S0304405X12000803,Journal of Financial Economics,2012,106,2
The market for new issues of municipal bonds: The roles of transparency and limited access to retail investors,"I examine how transparency and interdealer trading affects prices investors pay in municipal bond offerings. Real-time trade reporting for municipal bonds started January 31, 2005. The dispersion of purchase prices fell sharply at that time. There was little impact on average markups for most trades, but they increased for purchases of more than $100,000. Bonds often pass through a series of dealers before being placed with a buy-and-hold investor. As the interdealer trades progress, trade sizes decline and trade prices rise. Markups on investor purchases increase with the amount of interdealer trading before the trade.",['Paul Schultz'],"['Municipal bond', 'Dealer market', 'Transparency']",[],December,https://www.sciencedirect.com//science/article/pii/S0304405X12001547,Journal of Financial Economics,2012,106,3
Endogenous technological progress and the cross-section of stock returns,"I study the cross-sectional variation of stock returns and technological progress using a dynamic equilibrium model with production. Technological progress is endogenously driven by research and development (R&D) investment and is composed of two parts. One part is devoted to product innovation; the other, to increasing the productivity of physical investment. The latter is embodied in new tangible capital. The model breaks the symmetry assumed in standard models between tangible and intangible capital, in which the accumulation processes of tangible and intangible capital stock do not affect each other. Qualitatively and, in many cases, quantitatively, the model explains well-documented empirical regularities.",['Xiaoji Lin'],"['Technological progress', 'R&D investment', 'Physical investment', 'Stock return']",[],February,https://www.sciencedirect.com//science/article/pii/S0304405X11001966,Journal of Financial Economics,2012,103,2
Doing battle with short sellers: The conflicted role of blockholders in bear raids,"If short sellers can destroy firm value by manipulating prices down, an informed blockholder has a powerful natural incentive to protect the value of his stake by trading against them. However, he also has a potentially conflicting incentive to use his information to generate trading profits. We show that a speculator can exploit this conflict and force the blockholder to buy a disproportionately large amount to prevent value destruction. This is costly for the blockholder because the trades must sometimes be executed at inflated prices. Given reasonable constraints on short sellers, a sufficiently large blockholder will have the incentive to absorb these losses and prevent a bear raid. However, conditions exist under which outside intervention may be warranted.","['Naveen Khanna', 'Richmond D. Mathews']","['Speculation', 'Short selling', 'Regulation', 'Manipulation', 'Bear raids']",[],November,https://www.sciencedirect.com//science/article/pii/S0304405X12001328,Journal of Financial Economics,2012,106,2
Bargaining power and industry dependence in mergers,"In contrast to the widely held belief that targets capture the lion's share of merger gains, I show that the average dollar gains to targets are only modestly more than the dollar gains to acquirers. To help explain the variation in merger outcomes, I present empirical evidence in support of a new hypothesis that a target's relative scarcity (proxied by its market power) and product market dependence (proxied by customer–supplier relations) help to explain its share of the total merger gains. These results provide new evidence for an unexplored role of product markets on bargaining outcomes in mergers.",['Kenneth R. Ahern'],"['Mergers and acquisitions', 'Division of gains', 'Product market relations', 'Bargaining']",[],March,https://www.sciencedirect.com//science/article/pii/S0304405X11002133,Journal of Financial Economics,2012,103,3
"Size, value, and momentum in international stock returns","In the four regions (North America, Europe, Japan, and Asia Pacific) we examine, there are value premiums in average stock returns that, except for Japan, decrease with size. Except for Japan, there is return momentum everywhere, and spreads in average momentum returns also decrease from smaller to bigger stocks. We test whether empirical asset pricing models capture the value and momentum patterns in international average returns and whether asset pricing seems to be integrated across the four regions. Integrated pricing across regions does not get strong support in our tests. For three regions (North America, Europe, and Japan), local models that use local explanatory returns provide passable descriptions of local average returns for portfolios formed on size and value versus growth. Even local models are less successful in tests on portfolios formed on size and momentum.","['Eugene F. Fama', 'Kenneth R. French']","['Value premium', 'Momentum', 'Three-factor model', 'Four-factor model']",[],September,https://www.sciencedirect.com//science/article/pii/S0304405X12000931,Journal of Financial Economics,2012,105,3
Incentives to innovate and financial crises,"In this paper I develop a model of a competitive financial system with unrestricted but costly entry and an endogenously determined number of competing financial institutions (“banks” for short). Banks can make standard loans on which plentiful historical data are available and unanimous agreement exists on default probabilities. Or banks can innovate and make new loans on which limited historical data are available, leading to possible disagreement over default probabilities. In equilibrium, banks make zero profits on standard loans and positive profits on innovative loans, which engenders innovation incentives for banks. But innovation brings with it the risk that investors could disagree with the bank that the loan is worthy of continued funding and hence could withdraw funding at an interim stage, precipitating a financial crisis. The degree of innovation in the financial system is determined by this trade-off. Welfare implications of financial innovation and mechanisms to reduce the probability of crises are discussed.",['Anjan V. Thakor'],"['Financial innovation', 'Disagreement', 'Financial crises']",[],January,https://www.sciencedirect.com//science/article/pii/S0304405X11001887,Journal of Financial Economics,2012,103,1
"Cash holdings, risk, and expected returns","In this paper I develop and empirically test a model that highlights how the correlation between cash flows and a source of aggregate risk affects a firm's optimal cash holding policy. In the model, riskier firms (i.e., firms with a higher correlation between cash flows and the aggregate shock) are more likely to use costly external funding to finance their growth option exercises and have higher optimal savings. This precautionary savings motive implies a positive relation between expected equity returns and cash holdings. In addition, this positive relation is stronger for firms with less valuable growth options. Using a data set of US pubic companies, I find evidence consistent with the model's predictions.",['Berardino Palazzo'],"['Expected equity returns', 'Precautionary savings', 'Growth options']",[],April,https://www.sciencedirect.com//science/article/pii/S0304405X11002856,Journal of Financial Economics,2012,104,1
Variance bounds on the permanent and transitory components of stochastic discount factors,"In this paper, we develop lower bounds on the variance of the permanent component and the transitory component, and on the variance of the ratio of the permanent to the transitory components of SDFs. Exactly solved eigenfunction problems are then used to study the empirical attributes of asset pricing models that incorporate long-run risk, external habit persistence, and rare disasters. Specific quantitative implications are developed for the variance of the permanent and the transitory components, the return behavior of the long-term bond, and the comovement between the transitory and the permanent components of SDFs.","['Gurdip Bakshi', 'Fousseni Chabi-Yo']","['Stochastic discount factors', 'Permanent component', 'Transitory component', 'Variance bounds', 'Eigenfunction problems']",[],July,https://www.sciencedirect.com//science/article/pii/S0304405X12000049,Journal of Financial Economics,2012,105,1
Securitization without adverse selection: The case of CLOs,"In this paper, we investigate whether securitization was associated with risky lending in the corporate loan market by examining the performance of individual loans held by collateralized loan obligations. We employ two different data sets that identify loan holdings for a large set of CLOs and find that adverse selection problems in corporate loan securitizations are less severe than commonly believed. Using a battery of performance tests, we find that loans securitized before 2005 performed no worse than comparable unsecuritized loans originated by the same bank. Even loans originated by the bank that acts as the CLO underwriter do not show under-performance relative to the rest of the CLO portfolio. While some evidence exists of under-performance for securitized loans originated between 2005 and 2007, it is not consistent across samples, performance measures, and horizons. Overall, we argue that the securitization of corporate loans is fundamentally different from securitization of other assets classes because securitized loans are fractions of syndicated loans. Therefore, mechanisms used to align incentives in a lending syndicate are likely to reduce adverse selection in the choice of CLO collateral.","['Efraim Benmelech', 'Jennifer Dlugosz', 'Victoria Ivashina']","['Structured finance', 'Collateralized loan obligations (CLOs)', 'CDOs', 'Syndicated loans']",[],October,https://www.sciencedirect.com//science/article/pii/S0304405X12000773,Journal of Financial Economics,2012,106,1
Delegated trading and the speed of adjustment in security prices,"Institutional trading arrangements often involve the portfolio manager delegating the task of trade execution to a separate division within the firm. We model the agency conflict that arises in this setting and show that optimal performance benchmarks often create an incentive to execute orders contrary to concurrent information flow. We hypothesize that aggregate contrarian trading resulting from widespread application of such benchmarks leads to delays in the assimilation of information in security prices. Using institutional trading data, we document the hypothesized contrarian trading pattern and relate the pattern to price-adjustment delays in the response of individual stocks to index futures returns. The evidence supports the assertion that delegated institutional trading contributes to these delays.","['Roger M. Edelen', 'Gregory B. Kadlec']","['Trading', 'Agency conflict', 'Institutional investing']",[],February,https://www.sciencedirect.com//science/article/pii/S0304405X11002182,Journal of Financial Economics,2012,103,2
