title,abstract,authors,keywords,affiliations,month,link,journal_name,year,volume,issue
Independent boards and innovation,"Much research has suggested that independent boards of directors are more effective in reducing agency costs and improving firm governance. How they influence innovation is less clear. Relying on regulatory changes, we show that firms that transition to independent boards focus on more crowded and familiar areas of technology. They patent and claim more and receive more total future citations to their patents. However, the citation increase comes mainly from incremental patents in the middle of the citation distribution; the numbers of uncited and highly cited patents—arguably associated with riskier innovation strategies—do not change significantly.","['Benjamin Balsmeier', 'Lee Fleming', 'Gustavo Manso']","['Corporate governance', 'Board composition', 'Innovation', 'Exploration and exploitation']",[],March,https://www.sciencedirect.com//science/article/pii/S0304405X16302355,Journal of Financial Economics,2017,123,3
Tracing out capital flows: How financially integrated banks respond to natural disasters,"Multi-market banks reallocate capital when local credit demand increases after natural disasters. Using property damage as an instrument for lending growth, we find credit in unaffected but connected markets declines by a little less than 50 cents per dollar of additional lending in shocked areas. However, banks shield their core markets because most of the decline comes from loans in areas where banks do not own branches. Moreover, banks increase sales of more-liquid loans and they bid up the rate on deposits in the connected markets. These actions help lessen the impact of the demand shock on credit supply.","['Kristle Romero Cortés', 'Philip E. Strahan']",[],[],July,https://www.sciencedirect.com//science/article/pii/S0304405X17300806,Journal of Financial Economics,2017,125,1
Limited disclosure and hidden orders in asset markets,Opacity assumes at least two prominent forms in asset markets. Dark exchanges and over-the-counter markets enable expert investors to hide their orders while originators carefully control the disclosure of fundamental information about the assets they source. We describe a simple model in which both forms of opacity – hidden orders and limited disclosure – complement one another. Costly investor expertise gives originators incentives to deliver assets of good quality. Keeping expert orders hidden generates the rents investors need to justify investing in expertise in the first place. Limiting disclosure mitigates the resulting adverse selection issues. Originators prefer to restrict the information they can convey to experts because it encourages the participation of non experts. This optimal organization of asset markets can be decentralized using standard financial arrangements.,"['Cyril Monnet', 'Erwan Quintin']","['Market design', 'Opacity', 'Asymmetric information']",[],March,https://www.sciencedirect.com//science/article/pii/S0304405X16302392,Journal of Financial Economics,2017,123,3
The effect of director experience on acquisition performance,"Prior research finds that firms hire directors for their acquisition experience, regardless of acquisition quality (whether their prior acquisitions earned positive or negative announcement returns). Using several short- and long-run measures, we examine the effects of directors’ acquisition experience on the acquisition performance of firms hiring them. We find that board acquisition experience is positively related to subsequent acquisition performance, demonstrating that firms appropriately value experience. Beyond experience itself, however, the quality of directors’ prior acquisitions is also important. Our results suggest that firms may be better served to select directors based upon both past acquisition experience and acquisition performance.","['Laura Casares Field', 'Anahit Mkrtchyan']","['Corporate governance', 'Board of directors', 'Mergers and acquisitions']",[],March,https://www.sciencedirect.com//science/article/pii/S0304405X16302318,Journal of Financial Economics,2017,123,3
Skill and luck in private equity performance,"Private equity (PE) performance is persistent, with PE firms consistently producing high (or low) net-of-fees returns. We use a new variance decomposition model to isolate three components of persistence. We find high long-term persistence: the spread in expected net-of-fee future returns between top and bottom quartile PE firms is 7–8 percentage points annually. This spread is estimated controlling for spurious persistence, which arises mechanically from the overlap of contemporaneous funds. Performance is noisy, however, making it difficult for investors to identify the PE funds with top quartile expected future performance and leaving little investable persistence.","['Arthur Korteweg', 'Morten Sorensen']","['Persistence', 'Private equity', 'Venture capital', 'Skill', 'Learning']",[],June,https://www.sciencedirect.com//science/article/pii/S0304405X17300430,Journal of Financial Economics,2017,124,3
The U.S. listing gap,"Relative to other countries, the U.S. now has abnormally few listed firms. This “U.S. listing gap” is consistent with a decrease in the net benefit of a listing for U.S. firms. Since the listing peak in 1996, the propensity to be listed is lower for all firm size categories and industries, the new list rate is low, and the delist rate is high. The high delist rate accounts for 46% of the listing gap and the low new list rate for 54%. The high delist rate is explained by an unusually high rate of acquisitions of publicly listed firms.","['Craig Doidge', 'G. Andrew Karolyi', 'René M. Stulz']","['Stock market listing', 'New list', 'Delist']",[],March,https://www.sciencedirect.com//science/article/pii/S0304405X1630232X,Journal of Financial Economics,2017,123,3
Activism mergers,"Shareholder value creation from hedge fund activism occurs primarily by influencing takeover outcomes for targeted firms. Controlling for selection decisions, activist interventions substantially increase the probability of a takeover offer. Third-party bids for targets have higher returns, premia, and completion rates, but these patterns reverse when the activist is the bidder. Failed bids for activism targets lead to improvements in operating performance, financial policy, and positive long-term abnormal returns, suggesting that activism enhances value. The positive long-term performance from hedge fund activism arises from monitoring target management during merger and acquisition contests and not from target undervaluation or bidder overpayment.","['Nicole M. Boyson', 'Nickolay Gantchev', 'Anil Shivdasani']","['Hedge fund activism', 'Shareholder activism', 'Corporate governance', 'Mergers and acquisitions', 'Institutional investors']",[],October,https://www.sciencedirect.com//science/article/pii/S0304405X17301253,Journal of Financial Economics,2017,126,1
Reputation and signaling in asset sales,"Static adverse selection models of security issuance show that informed issuers can perfectly reveal their private information by maintaining a costly stake in the securities they issue. This paper shows that allowing an issuer to both signal current security quality via retention and build a reputation for honesty leads that issuer to misreport quality even when owning a positive stake, that is, the equilibrium is neither separating nor pooling. An issuer retains less as reputation improves and prices are more sensitive to retention when the issuer has a worse reputation.",['Barney Hartman-Glaser'],"['Costly signaling', 'Reputation', 'Repeated games', 'Asset-backed securities']",[],August,https://www.sciencedirect.com//science/article/pii/S0304405X17301009,Journal of Financial Economics,2017,125,2
Informed trading and price discovery before corporate events,"Stock prices incorporate less news before negative events than positive events. Further, informed agents use less price aggressive (limit) orders before negative events and more price aggressive (market) orders before positive events (buy–sell asymmetry). Motivated by these patterns, we model the execution risk that informed agents impose on each other and relate the asymmetry to costly short selling. When investor base is narrow, security borrowing is difficult, or the magnitude of the event is small, buy–sell asymmetry is pronounced and price discovery before negative events is lower. Overall, we show that the strategies of informed traders influence the process of price formation in financial markets, as predicted by theory.","['Shmuel Baruch', 'Marios Panayides', 'Kumar Venkataraman']","['Informed trader', 'Insider trading', 'Limit order', 'Short selling', 'Buy–sell asymmetry']",[],September,https://www.sciencedirect.com//science/article/pii/S0304405X17300995,Journal of Financial Economics,2017,125,3
Banking integration and house price co-movement,"The correlation in house price growth across US states increased steadily between 1976 and 2000. This paper shows that the contemporaneous geographic integration of the US banking market, via the emergence of large banks, was a primary driver of this phenomenon. To this end, we first theoretically derive an appropriate measure of banking integration across state pairs and show that house price growth correlation is strongly related to this measure of financial integration. Our instrumental variable estimates suggest that banking integration can explain up to one-fourth of the rise in house price correlation over this period.","['Augustin Landier', 'David Sraer', 'David Thesmar']","['Financial integration', 'Co-movement', 'House prices']",[],July,https://www.sciencedirect.com//science/article/pii/S0304405X17300375,Journal of Financial Economics,2017,125,1
Growth through rigidity: An explanation for the rise in CEO pay,"The dramatic rise in CEO compensation during the 1990s and early 2000s is a longstanding puzzle. In this paper, we show that much of the rise can be explained by a tendency of firms to grant the same number of options each year. Number-rigidity implies that the grant-date value of option awards will grow with firm equity returns, which were very high on average during the tech boom. Further, other forms of CEO compensation did not adjust to offset the dramatic growth in the value of option pay. Number-rigidity in options can also explain the increased dispersion in pay, the difference in growth between the US and other countries, and the increased correlation between pay and firm-specific equity returns. We present evidence that number-rigidity arose from a lack of sophistication about option valuation that is akin to money illusion. We show that regulatory changes requiring transparent expensing of the grant-date value of options led to a decline in number-rigidity and helps explain why executive pay increased less with equity returns during the housing boom in the mid-2000s.","['Kelly Shue', 'Richard R. Townsend']","['Executive compensation', 'Stock options', 'Money illusion', 'Expensing', 'Disclosure']",[],January,https://www.sciencedirect.com//science/article/pii/S0304405X16301477,Journal of Financial Economics,2017,123,1
Maximum likelihood estimation of the equity premium,"The equity premium — the expected return on the aggregate stock market less the government bill rate – is of central importance to the portfolio allocation of individuals, to the investment decisions of firms, and to model calibration and testing. This quantity is usually estimated from the sample average excess return. We propose an alternative estimator, based on maximum likelihood, that takes into account information contained in dividends and prices. Applied to the postwar sample, our method leads to an economically significant reduction from 6.4% to 5.1%. Simulation results show that our method produces more reliable estimates under a wide range of specifications.","['Efstathios Avdis', 'Jessica A. Wachter']","['Equity premium puzzle', 'Size puzzle', 'Return predictability']",[],September,https://www.sciencedirect.com//science/article/pii/S0304405X17301204,Journal of Financial Economics,2017,125,3
Socioeconomic status and learning from financial information,"The majority of lower socioeconomic status (SES) households in the U.S. and Europe do not have stock investments, which is detrimental to wealth accumulation. Here, we examine one explanation for this puzzling fact, namely, that economic adversity may influence how people learn from financial information. Using experimental and survey data from the U.S. and Romania, we find that lower SES individuals form more pessimistic beliefs about the distribution of stock returns and are less likely to invest in stocks when these investments are likely to have good outcomes. SES-related differences in pessimism may help explain variation in investments across households.","['Camelia M. Kuhnen', 'Andrei C. Miu']","['Socioeconomic status', 'Learning', 'Beliefs', 'Household finance', 'Stock market participation']",[],May,https://www.sciencedirect.com//science/article/pii/S0304405X17300387,Journal of Financial Economics,2017,124,2
Intangible capital and the investment-q relation,"The neoclassical theory of investment has mainly been tested with physical investment, but we show that it also helps explain intangible investment. At the firm level, Tobin’s q explains physical and intangible investment roughly equally well, and it explains total investment even better. Compared with physical capital, intangible capital adjusts more slowly to changes in investment opportunities. The classic q theory performs better in firms and years with more intangible capital: Total and even physical investment are better explained by Tobin’s q and are less sensitive to cash flow. At the macro level, Tobin’s q explains intangible investment many times better than physical investment. We propose a simple, new Tobin’s q proxy that accounts for intangible capital, and we show that it is a superior proxy for both physical and intangible investment opportunities.","['Ryan H. Peters', 'Lucian A. Taylor']","['Intangible capital', 'Investment', 'Tobin’s q', 'R&D', 'Organization capital']",[],February,https://www.sciencedirect.com//science/article/pii/S0304405X16301969,Journal of Financial Economics,2017,123,2
How persistent is private equity performance? Evidence from deal-level data,"The persistence of returns is a critical issue for investors in their choice of private equity managers. In this paper, we analyse buyout performance persistence in new ways, using a unique database containing cash flow data on 13,523 portfolio company investments by 865 buyout funds. We focus on unique realized deals and find that persistence of fund managers has substantially declined as the private equity sector has matured and become more competitive. Private equity has, therefore, largely conformed to the pattern found in most other asset classes in which past performance is a poor predictor of the future.","['Reiner Braun', 'Tim Jenkinson', 'Ingo Stoff']","['Private equity', 'Returns', 'Performance persistence', 'Portfolio companies']",[],February,https://www.sciencedirect.com//science/article/pii/S0304405X16301775,Journal of Financial Economics,2017,123,2
Efficiency and stability of a financial architecture with too-interconnected-to-fail institutions,"The regulation of large interconnected financial institutions has become a key policy issue. To improve financial stability, regulators have proposed limiting banks’ size and interconnectedness. I estimate a network-based model of the over-the-counter interbank lending market in the US and quantify the efficiency-stability implications of this policy. Trading efficiency decreases with limits on interconnectedness because the intermediation chains become longer. While restricting the interconnectedness of banks improves stability, the effect is non-monotonic. Stability also improves with higher liquidity requirements, when banks have access to liquidity during the crisis, and when failed banks’ depositors maintain confidence in the banking system.",['Michael Gofman'],"['Financial regulation', 'Networks', 'Trading efficiency', 'Contagion risk', 'Federal funds market']",[],April,https://www.sciencedirect.com//science/article/pii/S0304405X16302471,Journal of Financial Economics,2017,124,1
Systemic co-jumps,"The simultaneous occurrence of jumps in several stocks can be associated with major financial news, triggers short-term predictability in stock returns, is correlated with sudden spikes of the variance risk premium, and determines a persistent increase (decrease) of stock variances and correlations when they come along with bad (good) news. These systemic events and their implications can be easily overlooked by traditional univariate jump statistics applied to stock indices. They are instead revealed in a clearly cut way by using a novel test procedure applied to individual assets, which is particularly effective on high-volume stocks.","['Massimiliano Caporin', 'Aleksey Kolokolov', 'Roberto Renò']","['Jumps', 'Return predictability', 'Systemic events', 'Variance risk premium']",[],December,https://www.sciencedirect.com//science/article/pii/S0304405X17301332,Journal of Financial Economics,2017,126,3
Interbank networks in the National Banking Era: Their purpose and their role in the Panic of 1893,"The unit banking structure of the United States produced a uniquely important interbank correspondent network. During the National Banking Era, this network normally provided banks with access to money markets, facilitated payment processing, and helped banks meet legal reserve requirements. In crises, network connections could be a source of liquidity risk. That risk became evident during the Panic of 1893, when New York suspended convertibility. Banks with high two-sided liquidity risk (those holding more of their liquid assets with their correspondents and funded to a greater extent by deposits of other banks) were particularly exposed and more likely to close.","['Charles W. Calomiris', 'Mark Carlson']","['Interbank networks', 'Correspondent banking', 'Banking panics', 'Contagion', 'National Banking Era']",[],September,https://www.sciencedirect.com//science/article/pii/S0304405X17301241,Journal of Financial Economics,2017,125,3
Large shareholders and credit ratings,"This paper addresses regulatory concerns that large shareholders of credit rating agencies can influence the rating process. Unlike Standard & Poor's, which is a privately held division of McGraw-Hill, Moody's is a public company listed on the NYSE. From 2001 to 2010, Moody's has two shareholders, Berkshire Hathaway and Davis Selected Advisors, which collectively own about 23.5% of Moody's. Moody's ratings on bonds issued by important investee firms of these two stable large shareholders are more favorable relative to S&P, as well as Fitch, ratings. We exploit Moody's initial public offering in 2000 to address endogeneity and to mitigate concerns that the results are driven by issuer characteristics or by the greater informativeness of Moody's ratings. S&P's parent, McGraw-Hill, has a large shareholder for much less time, and some weak evidence exists that S&P ratings are relatively more favorable toward the owners of McGraw-Hill. These findings are consistent with regulatory concerns about the ownership and governance of rating agencies, especially those that are publicly listed.","['Simi Kedia', 'Shivaram Rajgopal', 'Xing\u2009(Alex) Zhou']","[""Moody's"", 'Credit rating agencies', 'Ownership structure', 'Conflict of interest', 'Difference-in-differences', 'Corporate bond', 'CMBS']",[],June,https://www.sciencedirect.com//science/article/pii/S0304405X17300442,Journal of Financial Economics,2017,124,3
Are foreign investors locusts? The long-term effects of foreign institutional ownership,"This paper challenges the view that foreign investors lead firms to adopt a short-term orientation and forgo long-term investment. Using a comprehensive sample of publicly listed firms in 30 countries over the period 2001–2010, we find instead that greater foreign institutional ownership fosters long-term investment in tangible, intangible, and human capital. Foreign institutional ownership also leads to significant increases in innovation output. We identify these effects by exploiting the exogenous variation in foreign institutional ownership that follows the addition of a stock to the MSCI indexes. Our results suggest that foreign institutions exert a disciplinary role on entrenched corporate insiders worldwide.","['Jan Bena', 'Miguel A Ferreira', 'Pedro Matos', 'Pedro Pires']","['Innovation', 'Institutional ownership', 'Investment', 'Monitoring', 'Patents']",[],October,https://www.sciencedirect.com//science/article/pii/S0304405X17301526,Journal of Financial Economics,2017,126,1
Leverage and strategic preemption: Lessons from entry plans and incumbent investments,"This paper empirically investigates the effect of leverage on strategic preemption. Using new data on entry plans and incumbent investments from the American casino industry, I find that high leverage prevents incumbents from responding to entry threats. Facing the same set of entry plans, low-leverage incumbents expand physical capacity (by 30%), whereas high-leverage incumbents do not. This difference in investment matters because capacity installations preempt eventual entry. Stock market reactions to withdrawn plans imply that effective preemption increases incumbent firm value by 5%. My findings suggest that leverage matters for industry composition, not just firm-level investment.",['J. Anthony Cookson'],"['Leverage', 'Entry threats', 'Preemption', 'Financial constraints', 'Casino industry']",[],February,https://www.sciencedirect.com//science/article/pii/S0304405X16302173,Journal of Financial Economics,2017,123,2
Stock liquidity and default risk,"This paper examines the impact of stock liquidity on firm bankruptcy risk. Using the Securities and Exchange Commission decimalization regulation as a shock to stock liquidity, we establish that enhanced liquidity decreases default risk. Stocks with the highest default risk experience the largest improvements. We find two mechanisms through which stock liquidity reduces firm default risk: improving stock price informational efficiency and facilitating corporate governance by blockholders. Of the two mechanisms, the informational efficiency channel has higher explanatory power than the corporate governance channel.","['Jonathan Brogaard', 'Dan Li', 'Ying Xia']","['Stock liquidity', 'Bankruptcy risk', 'EDF', 'Price efficiency', 'Governance']",[],June,https://www.sciencedirect.com//science/article/pii/S0304405X17300405,Journal of Financial Economics,2017,124,3
Information networks: Evidence from illegal insider trading tips,"This paper exploits a novel hand-collected data set to provide a comprehensive analysis of the social relationships that underlie illegal insider trading networks. I find that inside information flows through strong social ties based on family, friends, and geographic proximity. On average, inside tips originate from corporate executives and reach buy-side investors after three links in the network. Inside traders earn prodigious returns of 35% over 21 days, with more central traders earning greater returns, as information conveyed through social networks improves price efficiency. More broadly, this paper provides some of the only direct evidence of person-to-person communication among investors.",['Kenneth R. Ahern'],"['Illegal insider trading', 'Information networks', 'Social networks']",[],July,https://www.sciencedirect.com//science/article/pii/S0304405X17300570,Journal of Financial Economics,2017,125,1
Investor flows and fragility in corporate bond funds,"This paper explores flow patterns in corporate bond mutual funds. We show that corporate bond funds exhibit a concave flow-to-performance relationship: their outflows are sensitive to bad performance more than their inflows are sensitive to good performance. Moreover, corporate bond funds tend to have greater sensitivity of outflows to bad performance when they have more illiquid assets and when the overall market illiquidity is high. These results point to the possibility of fragility in the fast-growing corporate bond market. The illiquidity of corporate bonds may generate a first-mover advantage among investors in corporate bond funds, amplifying their response to bad performance.","['Itay Goldstein', 'Hao Jiang', 'David T. Ng']","['Financial fragility', 'Payoff complementarities', 'Bond funds']",[],December,https://www.sciencedirect.com//science/article/pii/S0304405X17302325,Journal of Financial Economics,2017,126,3
Volatility of aggregate volatility and hedge fund returns,"This paper investigates empirically whether uncertainty about equity market volatility can explain hedge fund performance both in the cross section and over time. We measure uncertainty via volatility of aggregate volatility (VOV) and construct an investable version through returns on lookback straddles on the Chicago Board Options Exchange (CBOE) volatility index, VIX. We find that VOV exposure is a significant determinant of hedge fund returns. After controlling for fund characteristics, we find a robust and significant negative risk premium for VOV exposure in the cross section of hedge fund returns. We corroborate our results using statistical and parameterized proxies of VOV over a longer sample period.","['Vikas Agarwal', 'Y. Eser Arisoy', 'Narayan Y. Naik']","['Uncertainty', 'Volatility of volatility', 'Hedge funds', 'Performance', 'Risk']",[],September,https://www.sciencedirect.com//science/article/pii/S0304405X17301320,Journal of Financial Economics,2017,125,3
