title,abstract,authors,keywords,affiliations,month,link,journal_name,year,volume,issue
Offshore activities and financial vs operational hedging,"A key question is why many multinational firms forgo foreign exchange derivative (FX) hedging and instead use operational hedging. We propose an explanation based on illiquidity and the unique advantages of operational hedges. We use 10-K filings to construct dynamically updated text-based measures of the offshore sale of output, purchase of input, and ownership of assets. We find that firms use FX derivatives when they are liquid and generally available. Otherwise, they often favor purchasing input from the same nations they sell output to, an operational hedge. Quasi-natural experiments based on new derivative product launches suggest a likely causal relation.","['Gerard Hoberg', 'S. Katie Moon']","['Offshore operations', 'Operational hedging', 'Financial hedging', 'Risk management', '10-K filings']",[],August,https://www.sciencedirect.com//science/article/pii/S0304405X17300946,Journal of Financial Economics,2017,125,2
An extrapolative model of house price dynamics,"A model in which homebuyers make a modest approximation leads house prices to display three features present in the data but usually missing from rational models: momentum at one-year horizons, mean reversion at five-year horizons, and excess longer-term volatility relative to fundamentals. Approximating buyers assume that past prices reflect only contemporaneous demand, just like professional economists who use trends in housing prices to infer trends in housing demand. Consistent with survey evidence, this approximation leads buyers to expect increases in the market value of their homes after recent house price increases.","['Edward L. Glaeser', 'Charles G. Nathanson']","['Extrapolation', 'House prices']",[],October,https://www.sciencedirect.com//science/article/pii/S0304405X17301290,Journal of Financial Economics,2017,126,1
International tests of a five-factor asset pricing model,"Average stock returns for North America, Europe, and Asia Pacific increase with the book-to-market ratio (B/M) and profitability and are negatively related to investment. For Japan, the relation between average returns and B/M is strong, but average returns show little relation to profitability or investment. A five-factor model that adds profitability and investment factors to the three-factor model of Fama and French (1993) largely absorbs the patterns in average returns. As in Fama and French, 2015, Fama and French, 2016, the model's prime problem is failure to capture fully the low average returns of small stocks whose returns behave like those of low profitability firms that invest aggressively.","['Eugene F. Fama', 'Kenneth R. French']","['International asset pricing', 'Multifactor models', 'Dividend discount model']",[],March,https://www.sciencedirect.com//science/article/pii/S0304405X1630215X,Journal of Financial Economics,2017,123,3
The price of variance risk,"Between 1996 and 2014, it was costless on average to hedge news about future variance at horizons ranging from 1 quarter to 14 years. Only unexpected, transitory realized variance was significantly priced. These results present a challenge to many structural models of the variance risk premium, such as the intertemporal CAPM and recent models with Epstein–Zin preferences and long-run risks. The results are also difficult to reconcile with macro models in which volatility affects investment decisions. At the same time, the data allows us to distinguish between different disaster models; a model in which the stock market has a time-varying exposure to disasters and investors have power utility fits the major features of the variance term structure.","['Ian Dew-Becker', 'Stefano Giglio', 'Anh Le', 'Marius Rodriguez']","['Variance risk premium', 'Recursive preferences', 'Disasters']",[],February,https://www.sciencedirect.com//science/article/pii/S0304405X16302161,Journal of Financial Economics,2017,123,2
"Capital utilization, market power, and the pricing of investment shocks","Capital utilization and market power crucially affect asset prices in an economy exposed to shocks that improve real investment opportunities through capital-embodied technological innovations. We embed these two mechanisms in a standard general equilibrium model and show that (i) the price of risk for investment shocks is negative under fixed capital utilization, but positive under sufficiently flexible capital utilization, and (ii) the equity return exposure to investment shocks is negative under perfect competition, but positive under high market power. We further show that, high market power, persistent components in technology growth, and a strong preference for early resolution of uncertainty are jointly important to quantitatively match the observed equity risk premium.","['Lorenzo Garlappi', 'Zhongzhi Song']","['Investment shocks', 'Capital utilization', 'Market power', 'Risk premium']",[],December,https://www.sciencedirect.com//science/article/pii/S0304405X17302313,Journal of Financial Economics,2017,126,3
Reexamining staggered boards and shareholder value,"Cohen and Wang (2013) (CW2013) provide evidence consistent with market participants perceiving staggered boards to be value reducing. Amihud and Stoyanov (2016) (AS2016) contests these findings, reporting some specifications under which the results are not statistically significant. We show that the results retain their significance under a wide array of robustness tests that address the concerns expressed by AS2016. Our empirical findings reinforce the conclusions of CW2013.","['Alma Cohen', 'Charles C.Y. Wang']","['Corporate governance', 'Staggered boards', 'Takeover defense', 'Antitakeover provisions', 'Firm value', 'Delaware', 'Airgas']",[],September,https://www.sciencedirect.com//science/article/pii/S0304405X17301216,Journal of Financial Economics,2017,125,3
The impact of portfolio disclosure on hedge fund performance,"Consistent with the argument that portfolio disclosure reveals trade secrets, a difference-in-differences estimation suggests a drop in fund performance after a hedge fund begins filing Form 13F as well as an increase in return correlations with other funds in the same investment style. The drop in performance is concentrated among funds with larger expected proprietary costs of disclosure, for instance, funds that disclose a greater fraction of their assets or hold more illiquid stocks. The drop in performance cannot be fully explained by alternative explanations such as decreasing returns to scale or mean reversion in fund returns.",['Zhen Shi'],"['Mandatory portfolio disclosure', 'Hedge fund performance', 'Proprietary cost']",[],October,https://www.sciencedirect.com//science/article/pii/S0304405X17301186,Journal of Financial Economics,2017,126,1
"Shaped by their daughters: Executives, female socialization, and corporate social responsibility","Corporate executives managing some of the largest public companies in the U.S. are shaped by their daughters. When a firm’s chief executive officer (CEO) has a daughter, the corporate social responsibility rating (CSR) is about 9.1% higher, compared to a median firm. The results are robust to confronting several sources of endogeneity, e.g., examining first-born CEO daughters and CEO changes. The relation is strongest for diversity, but significant also for broader pro-social practices related to the environment and employee relations. Our study contributes to research on female socialization, heterogeneity in CSR policies, and plausibly exogenous determinants of CEOs’ styles.","['Henrik Cronqvist', 'Frank Yu']","['CEOs', 'Family environment', 'Female socialization', 'Corporate social responsibility']",[],December,https://www.sciencedirect.com//science/article/pii/S0304405X17302350,Journal of Financial Economics,2017,126,3
Are corporate inversions good for shareholders?,"Corporate inversion, the process of redomiciling for tax purposes, reduces corporate income taxes, but it imposes a personal tax cost that is shareholder-specific. We develop a model, incorporating the corporate tax benefits and personal tax costs, to quantify the return to inversion for different shareholders. Foreign and tax-exempt investors, along with the chief executive officer, disproportionately benefit. We show that an inversion simultaneously reduces the wealth of many taxable shareholders. The model illustrates an agency conflict in which heterogeneity in personal taxes generates a wealth transfer between shareholders. Furthermore, personal taxes offset the loss in government revenue by 39%.","['Anton Babkin', 'Brent Glover', 'Oliver Levine']","['Corporate governance', 'Fiduciary duty', 'Shareholder conflicts', 'Tax-clientele effects', 'Mergers and acquisitions']",[],November,https://www.sciencedirect.com//science/article/pii/S0304405X17301514,Journal of Financial Economics,2017,126,2
Why do loans contain covenants? Evidence from lending relationships,"Despite the importance of banks’ role as delegated monitors, little is known about how non-price terms of loan contracts are structured to optimize information production in a lending relationship. Using a large sample of corporate loans, this paper examines the effect of relationship lending on covenant choice. Consistent with information asymmetry theories, covenant tightness is relaxed over the duration of a relationship, especially for opaque borrowers. In contrast, the effect of lending relationship intensity on the number of covenants included in a loan follows an inverted U shape. I discuss potential explanations for this finding.",['Robert Prilmeier'],"['Relationships', 'Banking', 'Covenants', 'Information asymmetries', 'Monitoring incentives']",[],March,https://www.sciencedirect.com//science/article/pii/S0304405X16302379,Journal of Financial Economics,2017,123,3
The bright side of financial derivatives: Options trading and firm innovation,"Do financial derivatives enhance or impede innovation? We answer this question by examining the relationship between equity options markets and standard measures of firm innovation. We find that firms with more options trading activity generate more patents and patent citations per dollar invested in research and development (R&D), after accounting for other confounding factors. These results are confirmed when we use a propensity score matching procedure and an instrumental variable approach to control for the potential endogeneity of options trading. The evidence is consistent with the notion that the enhanced informational efficiency induced by options leads to an improved allocation of corporate resources. We further discuss possible underlying economic mechanisms through which more active options markets boost innovation and show that the effect remains substantial even after controlling for these mechanisms. Considering the average increase in the dollar volume of options traded for our sample firms, we conclude that a 200% move in options volume increases firm innovation by about 31%.","['Iván Blanco', 'David Wehrheim']","['Innovation', 'R&D productivity', 'Options market', 'Price informativeness', 'Career concerns']",[],July,https://www.sciencedirect.com//science/article/pii/S0304405X17300739,Journal of Financial Economics,2017,125,1
Who is internationally diversified? Evidence from the 401(k) plans of 296 firms,"Drawing on a novel database of the 401(k) plans of 296 firms, we examine the international equity allocations of 3.8 million individuals over the 2005–2011 period. We find enormous cross-individual variation, ranging from zero to more than 75%, and strong cohort effects, with younger cohorts investing more internationally than older ones and each cohort investing more internationally over time. Access to financial advice, lower fees, and more international fund choices are associated with higher international allocations, suggesting a role for plan design and policy. Education, financial literacy, and the fraction of foreign-born population in the ZIP code also have positive effects on international diversification, consistent with explanations based on familiarity bias and information barriers.","['Geert Bekaert', 'Kenton Hoyem', 'Wei-Yin Hu', 'Enrichetta Ravina']","['International diversification', 'Micro data', '401(k) portfolios']",[],April,https://www.sciencedirect.com//science/article/pii/S0304405X16302483,Journal of Financial Economics,2017,124,1
Early peek advantage? Efficient price discovery with tiered information disclosure,"From 2007 to June 2013, a small group of fee-paying, high-speed traders receive the Michigan Index of Consumer Sentiment two seconds before its broader release. Within this early peek window, we find highly concentrated trading and a fast price discovery of less than 200 milliseconds. Outside this narrow window, general investors trade at fully adjusted prices. We further establish a causal relationship between the early peek mechanism and the fast price discovery by isolating the impact of the early peek arrangement along two dimensions. In cross section, we use other news releases without the early peek (as controls); in time series, we use the sudden suspension of the early peek arrangement in July 2013 (as the treatment). Our difference-in-difference tests directly connect the early peek arrangement to more efficient price discovery — it results in faster price discovery, lower volatility, and faster resolution of uncertainty. These results show that contrary to the common perception, tiered information release may help to reduce, rather than enhance, the informational advantage of faster traders and improve the efficiency of the price discovery process in financial markets.","['Grace Xing Hu', 'Jun Pan', 'Jiang Wang']","['Early peek', 'Information disclosure', 'Price discovery', 'High frequency trading']",[],November,https://www.sciencedirect.com//science/article/pii/S0304405X1730154X,Journal of Financial Economics,2017,126,2
Interim fund performance and fundraising in private equity,"General partners (GPs) in private equity (PE) report the performance of an existing fund while raising capital for a follow-on fund. Interim performance has large effects on fundraising outcomes. The impact is greatest when backed by exits and for low reputation GPs. Faced with these incentives, GPs time their fundraising to coincide with periods of peak performance through two strategies: (1) exit and fundraise and (2) net asset value (NAV) management. Consistent with the former, performance peaks are greatest for funds with high realization rates. Consistent with the latter, low reputation GPs with low realization rates experience performance peaks and erosions in performance after fundraising.","['Brad M. Barber', 'Ayako Yasuda']","['Private equity', 'Venture capital', 'Institutional investors', 'Fund manager evaluation']",[],April,https://www.sciencedirect.com//science/article/pii/S0304405X17300016,Journal of Financial Economics,2017,124,1
Well-connected short-sellers pay lower loan fees: A market-wide analysis,"High loan fees generate short-selling constraints and, therefore, reduce price efficiency. Despite the importance of loan fees, empirical evidence on their determinants is scarce. Using a market-wide deal-by-deal data set on the Brazilian equity lending market which uniquely identifies borrowers, brokers, and lenders, we are able to construct a proxy of search costs at the borrower–stock–day level. We find that—for the same stock, on the same day—borrowers with higher search costs pay significantly higher loan fees. Our results suggest that regulators should encourage the use of a centralized lending platform to reduce search costs in the lending market.","['Fernando Chague', 'Rodrigo De-Losso', 'Alan De Genaro', 'Bruno Giovannetti']","['Loan fees', 'Short-selling restrictions', 'Search costs', 'Equity lending market', 'Opaque markets']",[],March,https://www.sciencedirect.com//science/article/pii/S0304405X16302495,Journal of Financial Economics,2017,123,3
Acquiring growth,"I develop a model of mergers in which M&A deals are used to reallocate investment opportunities. In equilibrium, acquirers lack internal growth options and seek out projects from targets in the M&A market. The model is able to reconcile many features of the merger data that I document, including the high productivity, investment, and valuation of target firms. Furthermore, in my model, profitability is highly predictive of acquisition, and merger transactions naturally lead to a substantial drop in profitability despite creating value for the acquirer.",['Oliver Levine'],"['Mergers and acquisitions', 'Growth options', 'Intangible capital', 'Corporate investment']",[],November,https://www.sciencedirect.com//science/article/pii/S0304405X17301484,Journal of Financial Economics,2017,126,2
Political uncertainty and investment: Causal evidence from U.S. gubernatorial elections,"I examine the link between political uncertainty and firm investment using U.S. gubernatorial elections as a source of plausibly exogenous variation in uncertainty. Investment declines 5% before all elections and up to 15% for subsamples of firms particularly susceptible to political uncertainty. I use term limits as an instrumental variable (IV) for election closeness. Because close elections are related to economic downturns, I find that the effect of close elections on investment is understated by more than half by ordinary least squares (OLS). Post-election rebounds in investment depend on whether an incumbent is re-elected. Finally, I provide evidence that firms delay equity and debt issuances tied to investments before elections.",['Candace E. Jens'],"['Investment', 'Political uncertainty', 'Gubernatorial elections']",[],June,https://www.sciencedirect.com//science/article/pii/S0304405X17300582,Journal of Financial Economics,2017,124,3
"Confidence, bond risks, and equity returns","I show that investor confidence (size of ambiguity) about future consumption growth is driven by past consumption growth and inflation. The impact of inflation on confidence has moved considerably over time and switched on average from negative to positive in 1997. Motivated by this evidence, I develop and estimate a model in which the confidence process has discrete regime shifts, and I find that the time-varying impact of inflation on confidence enables the model to match bond risks over different subperiods. The model can also account for stock and bond return predictability, and correlation between price-dividend ratios and inflation, among other features of the data.",['Guihai Zhao'],"['Bond returns', 'Equity returns', 'Correlation', 'Ambiguity', 'Regime switch']",[],December,https://www.sciencedirect.com//science/article/pii/S0304405X17302398,Journal of Financial Economics,2017,126,3
Financial dependence and innovation: The case of public versus private firms,"In this paper, we examine the relation between innovation and a firm’s financial dependence using a sample of privately held and publicly traded US firms. We find that public firms in external finance dependent industries spend more on research and development and generate a better patent portfolio than their private counterparts. However, public firms in internal finance dependent industries do not have a better innovation profile than private firms. The results are robust to various empirical strategies that address selection bias. The findings indicate that the influence of public listing on innovation depends on the need for external capital.","['Viral Acharya', 'Zhaoxia Xu']","['Private firms', 'Public firms', 'Innovation', 'R&D', 'Financial dependence']",[],May,https://www.sciencedirect.com//science/article/pii/S0304405X16300101,Journal of Financial Economics,2017,124,2
Designated market makers still matter: Evidence from two natural experiments,"Independent technological glitches forced two separate trading halts on different U.S. exchanges during the week of July 6, 2015. During each halt, all other exchanges remained open. We exploit exogenous variation provided by this unprecedented coincidence, in conjunction with a proprietary data set, to identify the causal impact of Designated Market Maker (DMM) participation on liquidity. When the voluntary liquidity providers on one exchange were removed, liquidity remained unchanged; when DMMs were removed, liquidity decreased market-wide. We find evidence consistent with the idea that these DMMs, despite facing only mild formal obligations, significantly improve liquidity in the modern electronic marketplace.","['Adam D. Clark-Joseph', 'Mao Ye', 'Chao Zi']","['Market makers', 'HFTs', 'Liquidity', 'Obligations', 'Trading halt']",[],December,https://www.sciencedirect.com//science/article/pii/S0304405X17302337,Journal of Financial Economics,2017,126,3
Systematic mistakes in the mortgage market and lack of financial sophistication,"Institutions often offer a menu of contracts to consumers in an attempt to create a separating equilibrium that reveals borrower types and provides better pricing. We test the effectiveness of a specific set of contracts in the mortgage market: mortgage points. Points allow borrowers to exchange an upfront amount for a decrease in the mortgage rate. We document that, on average, points takers lose about $700. Also, points takers are less financially savvy (less educated, older), and they make mistakes on other dimensions (e.g., inefficiently refinancing their mortgages). Overall, our results show that borrowers overestimate how long they will stay with the mortgage.","['Sumit Agarwal', 'Itzhak Ben-David', 'Vincent Yao']","['Discount points', 'Mortgage decision making', 'Refinancing', 'Leverage', 'Financial literacy', 'Household finance', 'Inattentiveness']",[],January,https://www.sciencedirect.com//science/article/pii/S0304405X16301258,Journal of Financial Economics,2017,123,1
Employment protection and takeovers,"Labor restructuring is a key driver of takeovers and the associated synergy gains worldwide. In a difference-in-differences research design, we show that major increases in employment protection reduce takeover activity by 14–27% and the combined firm gains (synergies) by over half. Consistent with the labor channel behind these effects, deals with greater potential for workforce restructuring show a greater reduction in volume, number, and synergies. Increases in employment protection impede layoffs, resulting in wage costs that match the magnitude of synergy losses. Offer prices are not fully adjusted, with both bidders and targets exhibiting lower returns following the reforms.","['Olivier Dessaint', 'Andrey Golubov', 'Paolo Volpin']","['Employment protection', 'Takeovers', 'Mergers and acquisitions', 'Synergy gains', 'Premiums', 'Efficiency']",[],August,https://www.sciencedirect.com//science/article/pii/S0304405X1730096X,Journal of Financial Economics,2017,125,2
The impacts of political uncertainty on asset prices: Evidence from the Bo scandal in China,"Models of political risk predict that increases in political uncertainty cause stock prices to fall, especially for politically sensitive firms. We use the event of the Bo Xilai political scandal in 2012 in China as an exogenous shock to identify the impact of political uncertainty on asset prices. We document that the Bo scandal caused a significant drop in stock prices, especially for firms that are more politically sensitive. Further analysis shows that the stock price drop is mainly driven by a change in discount rate, providing strong support for the existence of priced political risk.","['Laura Xiaolei Liu', 'Haibing Shu', 'K.C. John Wei']","['Political uncertainty', 'Politically sensitive firms', 'Stock returns', 'Discount rate news', 'Cash flow news']",[],August,https://www.sciencedirect.com//science/article/pii/S0304405X17301022,Journal of Financial Economics,2017,125,2
Fire sale discount: Evidence from the sale of minority equity stakes,"Most empirical studies estimate the impact of fire sales either without the benefit of market prices from frequent trades, as with aircraft sales, or without observing transaction prices, as with the forced sales of equity securities by mutual funds facing outflows. We observe both by studying firms’ sales of minority equity stakes in publicly listed third parties. We estimate the distressed sale discount to be about 8% while controlling for liquidity and for industry, or about double the 4% estimated for equity sales by distressed mutual funds. The discount becomes 13–14% if the stake sold is more than 5% of the firm or is sold as a block. Prices recover after distressed sales.","['Serdar Dinc', 'Isil Erel', 'Rose Liao']","['Fire sale', 'Liquidity', 'Distressed sale', 'Price recovery']",[],September,https://www.sciencedirect.com//science/article/pii/S0304405X17301265,Journal of Financial Economics,2017,125,3
