title,abstract,authors,keywords,affiliations,month,link,journal_name,year,volume,issue
Explaining CEO retention in misreporting firms,"We propose a framework that advances our understanding of Chief Executive Officer (CEO) retention decisions in misreporting firms. Consistent with economic intuition, outside directors are more likely to fire (retain) CEOs when retention (replacement) costs are high relative to replacement (retention) costs. When the decision is ambiguous because neither cost dominates, outside directors are more likely to retain the CEO when they both benefit from selling stock in the misreporting period. We show that joint abnormal selling captures director–CEO alignment incrementally to biographical overlap. This new proxy operationalizes information sharing and trust, making it useful for studying economic decision-making embedded in social relationships.","['Messod D. Beneish', 'Cassandra D. Marshall', 'Jun Yang']","['CEO turnover', 'CFO turnover', 'Fraud', 'Restatements', 'Insider trading', 'Litigation costs', 'Replacement costs']",[],March,https://www.sciencedirect.com//science/article/pii/S0304405X16302343,Journal of Financial Economics,2017,123,3
"Information percolation, momentum and reversal","We propose a joint theory of time-series momentum and reversal based on a rational-expectations model. We show that a necessary condition for momentum to arise in this framework is that information flows at an increasing rate. We focus on word-of-mouth communication as a mechanism that enforces this condition and generates short-term momentum and long-term reversal. Investors with heterogeneous trading strategies—contrarian and momentum traders—coexist in the marketplace. Although a significant proportion of investors are momentum traders, momentum is not completely eliminated. Word-of-mouth communication spreads rumors and generates price run-ups and reversals. Our theoretical predictions are in line with empirical findings.","['Daniel Andrei', 'Julien Cujean']","['Asset pricing', 'Momentum', 'Information percolation', 'Equilibrium']",[],March,https://www.sciencedirect.com//science/article/pii/S0304405X16302380,Journal of Financial Economics,2017,123,3
"Firm characteristics, consumption risk, and firm-level risk exposures","We propose a novel approach to measuring firm-level risk exposures and costs of equity. Using a simple consumption-based asset pricing model that explains nearly two-thirds of the variation in average returns across 55 anomaly portfolios, we map the relation between exposures to consumption risk and portfolio-level characteristics. We use this relation to calculate exposures to consumption risk at the firm level and show that the calculated consumption risk exposures yield portfolios with large differences in average returns and ex post consumption risk exposures consistent with those predicted by our calculated betas. Further, industry betas and risk premia implied by our procedure display economically intuitive variation over time. Finally, Fama-MacBeth regressions suggest that risk exposures calculated using our procedure dominate those from alternative factor models at explaining cross-sectional variation in returns.","['Robert F. Dittmar', 'Christian T. Lundblad']","['Consumption-based asset pricing', 'Anomalies', 'Firm-level cost of capital']",[],August,https://www.sciencedirect.com//science/article/pii/S0304405X17300934,Journal of Financial Economics,2017,125,2
Endogenous intermediation in over-the-counter markets,"We provide a theory of trading through intermediaries in over-the-counter markets. The role of intermediaries is to sustain trade. In our model, traders are connected through an informational network. Agents observe their neighbors’ actions and can trade with their counterparty in a given period through a path of intermediaries in the network. Nevertheless, agents can renege on their obligations. We show that trading through an informational network is essential to support trade when agents infrequently meet the same counteparty. However, intermediaries must receive fees to implement trades. Concentrated intermediation, as represented by a star network, is both constrained efficient and stable when agents incur linking costs. The center agent in a star can receive higher fees as well.","['Ana Babus', 'Tai-Wei Hu']","['Over-the-counter trading', 'Strategic default', 'Dynamic network formation']",[],July,https://www.sciencedirect.com//science/article/pii/S0304405X17300788,Journal of Financial Economics,2017,125,1
Variance risk premiums and the forward premium puzzle,"We provide new empirical evidence that world currency and U.S. stock variance risk premiums have nonredundant and significant predictive power for the appreciation rates of 22 with respect to the U.S. dollar, especially at the four-month and one-month horizons, respectively. The heterogeneous exposures of currencies to the currency variance risk premium are systematically rising along the line of inflation risk. We rationalize these findings in a consumption-based asset pricing model, with local consumption uncertainty and global inflation uncertainty characterized, respectively, by the stock and currency variance risk premiums.","['Juan M. Londono', 'Hao Zhou']","['Currency return predictability', 'Currency and stock variance risk premiums', 'Forward premium puzzle', 'Local consumption uncertainty', 'Global inflation uncertainty']",[],May,https://www.sciencedirect.com//science/article/pii/S0304405X17300259,Journal of Financial Economics,2017,124,2
It pays to write well,"We quantify the effects of easy-to-read disclosure documents on firm value by analyzing shareholder reports of closed-end investment companies in which the company's value can be estimated separately from the value of the company's underlying assets. Using a copy-editing software application that counts the pervasiveness of the most important ‘writing faults’ that make a document harder to read, our analysis provides evidence that issuing financial disclosure documents with low readability causes firms to trade at significant discounts relative to the value of their fundamentals. Our estimates suggest that a one-standard-deviation decrease in readability decreases firm value by a full 2.5%. In situations in which investors are more likely to rely on annual reports, the readability effect on firm value increases to 3.3%.","['Byoung-Hyoun Hwang', 'Hugh Hoikwang Kim']","['Disclosure characteristics', 'Readability', 'Firm value']",[],May,https://www.sciencedirect.com//science/article/pii/S0304405X17300193,Journal of Financial Economics,2017,124,2
Merger activity in industry equilibrium,"We quantify the impact of merger activity on productive efficiency. We develop and calibrate a dynamic industry-equilibrium model that features mergers, entry, and exit by heterogeneous firms. Mergers affect productivity directly through realized synergies, and indirectly through firms’ incentives to enter or exit the industry. Merger activity increases average firm productivity by 4.8%, of which 4.1% reflects the accumulation of synergies, and 0.7% the interaction between merger options and firms’ entry and exit decisions. We show that ignoring the implications of merger activity for public policies that promote entry can reverse the expected impact of these policies on productivity.","['Theodosios Dimopoulos', 'Stefano Sacchetto']","['Mergers', 'Entry', 'Exit', 'Industry equilibrium']",[],October,https://www.sciencedirect.com//science/article/pii/S0304405X17301319,Journal of Financial Economics,2017,126,1
Uncovering expected returns: Information in analyst coverage proxies,"We show that analyst coverage proxies contain information about expected returns. We decompose analyst coverage into abnormal and expected components using a simple characteristic-based model and show that firms with abnormally high analyst coverage subsequently outperform firms with abnormally low coverage by approximately 80 basis points per month. We also show abnormal coverage rises following exogenous shocks to underpricing and predicts improvements in firms’ fundamental performance, suggesting that return predictability stems from analysts more heavily covering underpriced stocks. Our findings highlight the usefulness of analysts’ actions in expected return estimations, and a potential inference problem when coverage proxies are used to study information asymmetry and dissemination.","['Charles M.C. Lee', 'Eric C. So']","['Analysts', 'Expected returns', 'Anomalies', 'Coverage', 'Measurement error', 'Return predictability']",[],May,https://www.sciencedirect.com//science/article/pii/S0304405X1730020X,Journal of Financial Economics,2017,124,2
The impact of firm prestige on executive compensation,"We show that chief executive officers (CEOs) of prestigious firms earn less. Total compensation is on average 8% lower for firms listed in Fortune’s ranking of America’s most admired companies. We suggest that CEOs are willing to trade off status and career benefits from working for a publicly admired company against additional monetary compensation. Our identification strategy is based on matched sample analyses, difference-in-differences regressions, and a regression discontinuity design. We perform several robustness checks and exclude many alternative explanations, including that firm prestige just proxies for better corporate governance or for increased exposure of the pay-setting process to media attention.","['Florens Focke', 'Ernst Maug', 'Alexandra Niessen-Ruenzi']","['CEO compensation', 'Firm prestige', 'Social status', 'Career benefits']",[],February,https://www.sciencedirect.com//science/article/pii/S0304405X16301799,Journal of Financial Economics,2017,123,2
Opportunism as a firm and managerial trait: Predicting insider trading profits and misconduct,"We show that opportunistic insiders can be identified through the profitability of their trades prior to quarterly earnings announcements (QEAs) and that opportunistic trading is associated with various kinds of firm or managerial misconduct. A value-weighted trading strategy based on (not necessarily pre-QEA) trades of opportunistic insiders earns monthly four-factor alphas of over 1%, which is much higher than in past insider trading literature and substantial and significant even on the short side. Firms with opportunistic insiders have higher levels of earnings management, restatements, US Securities and Exchange Commission enforcement actions, shareholder litigation, and executive compensation. These findings suggest that opportunism is a domain-general trait.","['Usman Ali', 'David Hirshleifer']","['Insider trading', 'Opportunistic behavior', 'Firm and insider misconduct']",[],December,https://www.sciencedirect.com//science/article/pii/S0304405X17302349,Journal of Financial Economics,2017,126,3
International correlation risk,"We show that the cross-sectional dispersion of conditional foreign exchange (FX) correlation is countercyclical and that currencies that perform badly (well) during periods of high dispersion yield high (low) average excess returns. We also find a negative cross-sectional association between average FX correlations and average option-implied FX correlation risk premiums. Our findings show that while investors in spot currency markets require a positive risk premium for exposure to high dispersion states, FX option prices are consistent with investors being compensated for the risk of low dispersion states. To address our empirical findings, we propose a no-arbitrage model that features unspanned FX correlation risk.","['Philippe Mueller', 'Andreas Stathopoulos', 'Andrea Vedolin']","['Correlation risk', 'Exchange rates', 'International finance']",[],November,https://www.sciencedirect.com//science/article/pii/S0304405X17302155,Journal of Financial Economics,2017,126,2
"Dark pool trading strategies, market quality and welfare","We show that when a continuous dark pool is added to a limit order book that opens illiquid, book and consolidated fill rates and volume increase, but spread widens, depth declines, and welfare deteriorates. The adverse effects on market quality and welfare are mitigated when book-liquidity builds but so are the positive effects on trading activity. All effects are stronger when traders’ valuations are less dispersed, access to the dark pool is greater, horizon is longer, and relative tick size larger.","['Sabrina Buti', 'Barbara Rindi', 'Ingrid M. Werner']","['Dark pool', 'Limit order book', 'Trading strategies']",[],May,https://www.sciencedirect.com//science/article/pii/S0304405X16300022,Journal of Financial Economics,2017,124,2
Ambiguity and the corporation: Group disagreement and underinvestment,"We study a dynamic corporate investment problem where decisions have to be made collectively by a group of agents holding heterogeneous beliefs and adhering to a “utilitarian” governance mechanism in which each agent has a given influence in the decision. In this setting we show that: (i) group decisions are typically dynamically inconsistent, (ii) dynamic inconsistency leads to inefficient underinvestment, and (iii) the ability to trade securities among insiders or with outsiders may restore efficient investment decisions but it may, in some cases, lead to inefficient overinvestment. Our theory can help explain the empirical evidence on the effect of diversity of groups, such as corporate boards, on firms’ outcomes and, more generally, on the difference between group and individual behavior.","['Lorenzo Garlappi', 'Ron Giammarino', 'Ali Lazrak']","['Ambiguity', 'Group decisions', 'Dynamic consistency', 'Dynamic real investment', 'Security issuance']",[],September,https://www.sciencedirect.com//science/article/pii/S0304405X17301228,Journal of Financial Economics,2017,125,3
Systemic risk in clearing houses: Evidence from the European repo market,"We study how crises affect Central Clearing Counterparties (CCPs). We focus on a large and safe segment of the CCP-cleared repo market during the Eurozone sovereign debt crisis. We develop a simple model to infer CCP stress, which is measured as repo rates’ sensitivity to sovereign credit default swaps (CDS) spreads and jointly captures (1) the effectiveness of haircut policies, (2) CCP-member default risk (conditional on sovereign default), and (3) CCP default risk (conditional on both sovereign and CCP-member default). During 2011, repo rates strongly respond to sovereign risk, particularly for Greece, Italy, Ireland, Portugal and Spain (GIIPS): Repo investors behaved as if the conditional probability of CCP default was substantial.","['Charles Boissel', 'François Derrien', 'Evren Ors', 'David Thesmar']","['Repurchase agreement', 'Sovereign debt crisis', 'LTRO', 'Secured money market lending', 'Clearing houses']",[],September,https://www.sciencedirect.com//science/article/pii/S0304405X17301277,Journal of Financial Economics,2017,125,3
"Information disclosure, firm growth, and the cost of capital","We study how information disclosure affects the cost of equity capital and investor welfare in a dynamic setting. We show that a firm’s cost of capital decreases (increases) in the precision of public disclosure if the firm’s growth rate is below (above) a certain threshold. The threshold growth rate is higher when the firm’s cash flows are more persistent, or when other firms in the economy are growing at low rates. While current shareholders always prefer maximum public disclosure, future shareholders’ welfare decreases (increases) in the precision of public disclosure if the firm’s growth rate is below (above) the threshold.","['Sunil Dutta', 'Alexander Nezlobin']","['Cost of capital', 'Information disclosure', 'Risk premium', 'Growth']",[],February,https://www.sciencedirect.com//science/article/pii/S0304405X16301982,Journal of Financial Economics,2017,123,2
Do managers overreact to salient risks? Evidence from hurricane strikes,"We study how managers respond to hurricane events when their firms are located in the neighborhood of the disaster area. We find that the sudden shock to the perceived liquidity risk leads managers to increase corporate cash holdings and to express more concerns about hurricane risk in 10-Ks/10-Qs, even though the actual risk remains unchanged. Both effects are temporary. Over time, the perceived risk decreases, and the bias disappears. The distortion between perceived and actual risk is large, and the increase in cash is suboptimal. Overall, managerial reaction to hurricanes is consistent with salience theories of choice.","['Olivier Dessaint', 'Adrien Matray']","['Behavioral bias', 'Risk perception', 'Corporate cash holdings', 'Availability heuristic', 'Risk management']",[],October,https://www.sciencedirect.com//science/article/pii/S0304405X17301496,Journal of Financial Economics,2017,126,1
Customer concentration and loan contract terms,"We study pricing and non-pricing features of loan contracts to gauge how the credit market evaluates a firm’s customer-base profile and supply-chain relations. Higher customer concentration increases interest rate spreads and the number of restrictive covenants featured in newly initiated as well as renegotiated bank loans. Customer concentration also abbreviates the maturity of those loans as well as the relationship between firms and their banks. These effects are intensified by customers’ financial distress, the level of relationship-specific investments, and the use of trade credit in customer–supplier relations. Our evidence shows that a deeper exposure to a small set of large customers bears negative consequences for a firm’s relations with its creditors, revealing limits to integration along the supply chain.","['Murillo Campello', 'Janet Gao']","['Customer concentration', 'Bank loans', 'Contract terms', 'Financial distress', 'Instrumental variables']",[],January,https://www.sciencedirect.com//science/article/pii/S0304405X16301738,Journal of Financial Economics,2017,123,1
The effects of removing barriers to equity issuance,"We study the consequences of a US deregulation allowing small firms to accelerate their public equity issuance. Post-deregulation, affected firms double their reliance on public equity and transition away from private investments in public equity compared to similar untreated firms. The net effect is a 5.7 percentage point or 49% increase in the annual probability of raising equity. This is accompanied by a reduction in equity issuance costs, an increase in investment, and a decrease in leverage. Our findings provide evidence that reducing equity issuance barriers benefits issuers even in highly developed markets.","['Matthew T. Gustafson', 'Peter Iliev']","['Seasoned equity offerings', 'PIPEs', 'Follow-on offering', 'SEO Issuance costs', 'Shelf registrations']",[],June,https://www.sciencedirect.com//science/article/pii/S0304405X17300569,Journal of Financial Economics,2017,124,3
The unintended consequences of the zero lower bound policy,"We study the impact of the zero lower bound interest rate policy on the industrial organization of the U.S. money fund industry. We find that in response to policies that maintain low interest rates, money funds: change their product offerings by investing in riskier asset classes; are more likely to exit the market; and reduce the fees they charge their investors. The consequence of fund closures resulting from interest rate policy is the relocation of resources in affected fund families and in the asset management industry in general, as well as decline in capital of issuers borrowing from money funds.","['Marco Di Maggio', 'Marcin Kacperczyk']","['Unconventional monetary policy', 'Money funds', 'Risk taking', 'Fund exit']",[],January,https://www.sciencedirect.com//science/article/pii/S0304405X1630157X,Journal of Financial Economics,2017,123,1
Explaining the negative returns to volatility claims: An equilibrium approach,"We study the returns to investing in VIX futures, VIX Exchange Traded Notes (ETNs), and variance swaps. We document substantial negative return premia for these assets. For example, the constant maturity portfolio of 1-month VIX futures loses about 30% per year over our sample period (2006–2013). We investigate if these findings are consistent with dynamic equilibrium. We derive a model based on present value computation that endogenizes stock prices, the VIX index, and its associated derivative contracts. The model explains the negative return premia as well as several other stylized features of the VIX futures, ETNs, and variance swap data.","['Bjørn Eraker', 'Yue Wu']","['Variance risk premium', 'VIX futures', 'VIX ETN', 'Dynamic equilibrium', 'Jump-diffusion']",[],July,https://www.sciencedirect.com//science/article/pii/S0304405X17300764,Journal of Financial Economics,2017,125,1
The term structure of returns: Facts and theory,"We summarize and extend the new literature on the term structure of equity. Short-term equity claims, or dividend strips, have higher average returns and Sharpe ratios than the aggregate stock market. The returns on short-term dividend claims are risky as measured by volatility, but safe as measured by market beta. These facts are hard to reconcile with traditional macro-finance models and we provide an overview of new models that can reproduce some of these facts. We relate our evidence on dividend strips to facts about other asset classes such as nominal and corporate bonds, volatility, and housing. We discuss the broader economic implications of our findings by linking the term structure of returns to real economic decisions such as hiring and investment. We conclude with an outline of empirical and theoretical extensions that we consider interesting avenues for future research.","['Jules H. van Binsbergen', 'Ralph S.J. Koijen']",[],[],April,https://www.sciencedirect.com//science/article/pii/S0304405X17300223,Journal of Financial Economics,2017,124,1
Offshore schemes and tax evasion: The role of banks,"We use mandatory Russian banks’ reports to the Central Bank to construct a novel measure of offshore-banking. Individual bank involvement in offshore operations is calculated as a fraction of total transactions with foreign countries that go through offshore financial centers. We find that offshore-active banks perform less financial intermediation and focus more on international wire transfers. We show a positive relation between banks’ offshore activities and tax evasion of companies doing business through these banks. Finally, we show that the Central Bank eventually responds to this behavior: offshore-active banks have higher likelihood of license revocation and criminal investigation against top-management.","['Lucy Chernykh', 'Sergey Mityakov']","['Financial institutions', 'Offshore banking', 'Tax evasion']",[],December,https://www.sciencedirect.com//science/article/pii/S0304405X17302362,Journal of Financial Economics,2017,126,3
"Option repricing, corporate governance, and the effect of shareholder empowerment","We use the practice of employee option repricing to investigate how shareholder involvement in firm compensation policies affects the quality of firm governance. We find that a 2003 reform that empowered shareholders to approve or reject repricing proposals led to value increases in previous repricers. The likelihood of repricing becomes less sensitive to poor manager performance, but remains similarly sensitive to bad luck, after the reform. Average post-repricing changes in firm performance are positive only after the reform. Overall, our results suggest that shareholder empowerment improves the governance of repricing and can transform repricing into a value-creating tool.","['Huseyin Gulen', ""William J. O'Brien""]","['Shareholder empowerment', 'Executive compensation', 'Corporate finance', 'Corporate governance', 'Corporate regulation']",[],August,https://www.sciencedirect.com//science/article/pii/S0304405X17300958,Journal of Financial Economics,2017,125,2
Diversification and cash dynamics,"Why do diversified firms hold significantly less cash than focused firms? We study this question using a dynamic model of corporate investment, saving, and diversification decisions. We find that investment dynamics are more important in explaining the cash differences than financing frictions. More efficient internal capital markets increase cash differences and are especially valuable when a firm diversifies or refocuses. Contrary to static models, more diverse conglomerates have lower cash differences. Endogenous selection (diversifying firms are larger and have better growth opportunities) accounts for 68% of the cash difference, and the diversification event itself reduces cash holdings by 32%.","['Tor-Erik Bakke', 'Tiantian Gu']","['Diversification', 'Organizational structure', 'Corporate saving', 'Internal capital markets', 'Investment']",[],March,https://www.sciencedirect.com//science/article/pii/S0304405X16302410,Journal of Financial Economics,2017,123,3
