title,abstract,authors,keywords,affiliations,month,link,journal_name,year,volume,issue
Investment-cash flow sensitivity cannot be a good measure of financial constraints: Evidence from the time series,"Investment-cash flow sensitivity has declined and disappeared, even during the 2007–2009 credit crunch. If one believes that financial constraints have not disappeared, then investment-cash flow sensitivity cannot be a good measure of financial constraints. The decline and disappearance are robust to considerations of R&D and cash reserves, and across groups of firms. The information content in cash flow regarding investment opportunities has declined, but measurement error in Tobin's q does not completely explain the patterns in investment-cash flow sensitivity. The decline and disappearance cannot be explained by changes in sample composition, corporate governance, or market power—and remain a puzzle.","['Huafeng (Jason) Chen', 'Shaojun (Jenny) Chen']","['Investment-cash flow sensitivity', 'Financial constraints', 'Credit crunch', 'Measurement error']",[],February,https://www.sciencedirect.com//science/article/pii/S0304405X11001929,Journal of Financial Economics,2012,103,2
Institutional determinants of capital structure adjustment speeds,"Many authors relate a firm's performance to legal and political features and the regulatory environment in which it operates. This article compares firms' capital structure adjustments across countries and investigates whether institutional differences help explain the variance in estimated adjustment speeds. We find that legal and financial traditions significantly correlate with firm adjustment speeds. More narrowly, institutional features also relate to adjustment speeds, consistent with the hypothesis that better institutions lower the transaction costs associated with adjusting a firm's leverage. Such associations between institutional arrangements and leverage adjustment speeds are consistent with the dynamic trade-off theory of capital structure choice.","['Özde Öztekin', 'Mark J. Flannery']","['Dynamic capital structure', 'Trade-off theory', 'International', 'Partial adjustment', 'Institutions']",[],January,https://www.sciencedirect.com//science/article/pii/S0304405X11001978,Journal of Financial Economics,2012,103,1
Is momentum really momentum?,"Momentum is primarily driven by firms' performance 12 to seven months prior to portfolio formation, not by a tendency of rising and falling stocks to keep rising and falling. Strategies based on recent past performance generate positive returns but are less profitable than those based on intermediate horizon past performance, especially among the largest, most liquid stocks. These facts are not particular to the momentum observed in the cross section of US equities. Similar results hold for momentum strategies trading international equity indices, commodities, and currencies.",['Robert Novy-Marx'],"['Momentum', 'Factor models']",[],March,https://www.sciencedirect.com//science/article/pii/S0304405X11001152,Journal of Financial Economics,2012,103,3
"Investor attention, psychological anchors, and stock return predictability","Motivated by psychological evidence on limited investor attention and anchoring, we propose two proxies for the degree to which traders under- and overreact to news, namely, the nearness to the Dow 52-week high and the nearness to the Dow historical high, respectively. We find that nearness to the 52-week high positively predicts future aggregate market returns, while nearness to the historical high negatively predicts future market returns. We further show that our proxies contain information about future market returns that is not captured by traditional macroeconomic variables and that our results are robust across G7 countries. Comprehensive Monte Carlo simulations and comparisons with the NYSE/Amex market cap index confirm the significance of these findings.","['Jun Li', 'Jianfeng Yu']","['Attention', 'Anchor', 'Overreaction', 'Underreaction', '52-week high']",[],May,https://www.sciencedirect.com//science/article/pii/S0304405X11002121,Journal of Financial Economics,2012,104,2
When do high stock returns trigger equity issues?,"One of the most prominent stylized facts in corporate finance is that equity issues tend to follow periods of high stock returns. We document that firms exhibit such timing behavior only in response to high returns that coincide with strong institutional investor demand. When not accompanied by institutional purchases, stock price increases have little impact on the likelihood of equity issuance. The results highlight the importance of market reception for the timing of equity issues.","['Aydoğan Altı', 'Johan Sulaeman']","['Market timing', 'Seasoned equity offerings', 'Institutional investors']",[],January,https://www.sciencedirect.com//science/article/pii/S0304405X11001905,Journal of Financial Economics,2012,103,1
The effect of board structure on firm value: A multiple identification strategies approach using Korean data,"Outside directors and audit committees are widely considered to be central elements of good corporate governance. We use a 1999 Korean law as an exogenous shock to assess whether and how board structure affects firm market value. The law mandates 50% outside directors and an audit committee for large public firms, but not smaller firms. We study this shock using event study, difference-in-differences, and instrumental variable methods, within an overall regression discontinuity approach. The legal shock produces economically large share price increases for large firms, relative to mid-sized firms; their share prices jump in 1999 when the reforms are announced.","['Bernard Black', 'Woochan Kim']","['Korea', 'Outside directors', 'Audit committee', 'Corporate governance', 'Board of directors']",[],April,https://www.sciencedirect.com//science/article/pii/S0304405X11001814,Journal of Financial Economics,2012,104,1
"Longevity risk, retirement savings, and financial innovation","Over the last couple of decades unprecedented increases in life expectancy have raised important concerns for retirement savings. We solve a life-cycle model with longevity risk, which can be hedged through endogenous saving and retirement decisions. We investigate the benefits of financial assets designed to hedge the shocks to survival probabilities. When longevity risk is calibrated to match forward-looking projections, those benefits are substantial. This lends support to the idea that such hedging should be pursued by defined benefit pension plans on behalf of their beneficiaries. Finally, we draw implications for optimal security design.","['João F. Cocco', 'Francisco J. Gomes']","['Life cycle savings', 'Mortality risk', 'Pension plans']",[],March,https://www.sciencedirect.com//science/article/pii/S0304405X11002339,Journal of Financial Economics,2012,103,3
Peer performance and stock market entry,"Peer performance can influence the adoption of financial innovations and investment styles. We present evidence of this type of social influence: recent stock returns that local peers experience affect an individual's stock market entry decision, particularly in areas with better opportunities for social learning. The likelihood of entry does not decrease as returns fall below zero, consistent with people not talking about decisions that have produced inferior outcomes. Market returns, media coverage, local stocks, omitted local variables, short sales constraints, and stock purchases within households do not seem to explain these results.","['Markku Kaustia', 'Samuli Knüpfer']","['Investor behavior', 'Peer effect', 'Social interaction', 'Social influence', 'Stock market participation']",[],May,https://www.sciencedirect.com//science/article/pii/S0304405X11001449,Journal of Financial Economics,2012,104,2
The effect of reference point prices on mergers and acquisitions,"Prior stock price peaks of targets affect several aspects of merger and acquisition activity. Offer prices are biased toward recent peak prices although they are economically unremarkable. An offer's probability of acceptance jumps discontinuously when it exceeds a peak price. Conversely, bidder shareholders react more negatively as the offer price is influenced upward toward a peak. Merger waves occur when high returns on the market and likely targets make it easier for bidders to offer a peak price. Parties thus appear to use recent peaks as reference points or anchors to simplify the complex tasks of valuation and negotiation.","['Malcolm Baker', 'Xin Pan', 'Jeffrey Wurgler']","['Mergers', 'Acquisitions', 'Offer price', 'Reference point', 'Behavioral corporate finance']",[],October,https://www.sciencedirect.com//science/article/pii/S0304405X12000712,Journal of Financial Economics,2012,106,1
The sources of value destruction in acquisitions by entrenched managers,"Prior work has established that entrenched managers make value-decreasing acquisitions. In this study, we determine how they destroy that value. Overall, we find that value destruction by entrenched managers comes from a combination of factors. First, they disproportionately avoid private targets, which have been shown to be generally associated with value creation. Second, when they do buy private targets or public targets with blockholders, they tend not to use all-equity offers, which has the effect of avoiding the transfer of a valuable blockholder to the bidder. We further test whether entrenched managers simply overpay for good targets or choose targets with lower synergies. We find that while they overpay, they also choose low synergy targets in the first place, as shown by combined announcement returns and post-merger operating performance.","['Jarrad Harford', 'Mark Humphery-Jenner', 'Ronan Powell']","['Corporate governance', 'Mergers', 'Entrenchment', 'Blockholders', 'Overpayment']",[],November,https://www.sciencedirect.com//science/article/pii/S0304405X12001110,Journal of Financial Economics,2012,106,2
Cash flows and leverage adjustments,"Recent research has emphasized the impact of transaction costs on firm leverage adjustments. We recognize that cashflow realizations can provide opportunities to adjust leverage at relatively low marginal cost. We find that a firm's cashflow features affect not only the leverage target, but also the speed of adjustment toward that target. Heterogeneity in adjustment speeds is driven by an economically meaningful concept: adjustment costs. Accounting for this fact produces adjustment speeds that are significantly faster than previously estimated in the literature. We also analyze how both financial constraints and market timing variables affect adjustments toward a leverage target.","['Michael Faulkender', 'Mark J. Flannery', 'Kristine Watson Hankins', 'Jason M. Smith']","['Leverage', 'Target', 'Speed of adjustment', 'Adjustment costs']",[],March,https://www.sciencedirect.com//science/article/pii/S0304405X11002583,Journal of Financial Economics,2012,103,3
Industry contagion in loan spreads,"Spreads on new and renegotiated corporate loans are significantly higher when the loan originates (or is renegotiated) in the two years surrounding bankruptcy filings by industry rivals. This industry-specific contagion is particularly severe in the middle of industry bankruptcy waves. Furthermore, this contagion in loan spreads is mitigated in concentrated industries, consistent with the hypothesis and evidence in Lang and Stulz (1992) that bankruptcy filings in concentrated industries can have positive consequences for rivals (increased market share and/or power). There is also some evidence that contagion affects non-spread terms in loan contracts.","['Michael G. Hertzel', 'Micah S. Officer']","['Bankruptcy', 'Financial distress', 'Contagion', 'Loan spreads']",[],March,https://www.sciencedirect.com//science/article/pii/S0304405X11002443,Journal of Financial Economics,2012,103,3
Do option markets undo restrictions on short sales? Evidence from the 2008 short-sale ban,The effectiveness of any sanction depends on the costs of avoiding its restrictions. We examine whether bearish option strategies were substitutes for short sales during the September 2008 short-sale ban. We find a significant diminution in option volumes and a significant increase in option bid-ask spreads for banned stock relative to unbanned stock during the ban period. Apparent violations of the put-call parity bound became significantly more frequent for banned stocks during the ban period. We conclude that the ban acted as an effective restriction on trading in options.,"['Bruce D. Grundy', 'Bryan Lim', 'Patrick Verwijmeren']","['Short-sale restrictions', 'Option markets', 'Spread relative to optionality', 'Put-call parity']",[],November,https://www.sciencedirect.com//science/article/pii/S0304405X12000955,Journal of Financial Economics,2012,106,2
Arbitrage crashes and the speed of capital,"The imminent failure of prime brokers during the 2008 financial crisis caused a sudden decrease in the leverage afforded hedge funds. This decrease resulted from the asymmetrical payoff to rehypothecation lenders—the ultimate financiers, through prime brokers, to hedge funds. Seemingly long-term debt capital became short-term capital creating a duration mismatch between left-hand side arbitrage opportunities and right-hand side liabilities. Consequently, arbitrageurs became unable to maintain similar prices of similar assets. Mispricing magnitudes, and the time required to correct them, reflect the role of arbitrageurs in maintaining accurate prices during normal times and offer an estimate of discounts at which assets transact during crises.","['Mark Mitchell', 'Todd Pulvino']","['Arbitrage', 'Financial crisis', 'Hedge funds']",[],June,https://www.sciencedirect.com//science/article/pii/S0304405X11001991,Journal of Financial Economics,2012,104,3
"Internal corporate governance, CEO turnover, and earnings management","The likelihood and speed of forced CEO turnover – but not voluntary turnover – are positively related to a firm's earnings management. These patterns persist in tests that consider the effects of earnings restatements, regulatory enforcement actions, and the possible endogeneity of CEO turnover and earnings management. The relation between earnings management and forced turnover occurs both in firms with good and bad performance, and when the accruals work to inflate or deflate reported earnings. These results indicate that boards tend to act proactively to discipline managers who manage earnings aggressively, before the manipulations lead to costly external consequences.","['Sonali Hazarika', 'Jonathan M. Karpoff', 'Rajarishi Nahata']","['Management turnover', 'Earnings management', 'Corporate governance']",[],April,https://www.sciencedirect.com//science/article/pii/S0304405X11002431,Journal of Financial Economics,2012,104,1
Securitized banking and the run on repo,"The panic of 2007–2008 was a run on the sale and repurchase market (the repo market), which is a very large, short-term market that provides financing for a wide range of securitization activities and financial institutions. Repo transactions are collateralized, frequently with securitized bonds. We refer to the combination of securitization plus repo finance as “securitized banking” and argue that these activities were at the nexus of the crisis. We use a novel data set that includes credit spreads for hundreds of securitized bonds to trace the path of the crisis from subprime-housing related assets into markets that had no connection to housing. We find that changes in the LIB-OIS spread, a proxy for counterparty risk, were strongly correlated with changes in credit spreads and repo rates for securitized bonds. These changes implied higher uncertainty about bank solvency and lower values for repo collateral. Concerns about the liquidity of markets for the bonds used as collateral led to increases in repo haircuts, that is the amount of collateral required for any given transaction. With declining asset values and increasing haircuts, the US banking system was effectively insolvent for the first time since the Great Depression.","['Gary Gorton', 'Andrew Metrick']","['Financial crisis', 'Panic', 'Sale and repurchase', 'Securitization', 'Subprime']",[],June,https://www.sciencedirect.com//science/article/pii/S0304405X1100081X,Journal of Financial Economics,2012,104,3
Information effect of entry into credit ratings market: The case of insurers' ratings,"The paper analyzes the effect of competition between credit rating agencies (CRAs) on the information content of ratings. We show that a monopolistic CRA pools sellers into multiple rating classes and has partial market coverage. This provides an opportunity for market entry. The entrant designs a rating scale distinct from that of the incumbent. It targets higher-than-average companies in each rating grade of the incumbent's rating scale and employs more stringent rating standards. We use Standard and Poor's (S&P) entry into the market for insurance ratings previously covered by a monopolist, A.M. Best, to empirically test the impact of entry on the information content of ratings. The empirical analysis reveals that S&P required higher standards to assign a rating similar to the one assigned by A.M. Best and that higher-than-average quality insurers in each rating category of A.M. Best chose to receive a second rating from S&P.","['Neil A. Doherty', 'Anastasia V. Kartasheva', 'Richard D. Phillips']","['Ratings', 'Competition', 'Information disclosure', 'Insurance']",[],November,https://www.sciencedirect.com//science/article/pii/S0304405X12000943,Journal of Financial Economics,2012,106,2
"Executive stock options, differential risk-taking incentives, and firm value","The sensitivity of stock options' payoff to return volatility, or vega, provides risk-averse CEOs with an incentive to increase their firms' risk more by increasing systematic rather than idiosyncratic risk. This effect manifests because any increase in the firm's systematic risk can be hedged by a CEO who can trade the market portfolio. Consistent with this prediction, we find that vega gives CEOs incentives to increase their firms' total risk by increasing systematic risk but not idiosyncratic risk. Collectively, our results suggest that stock options might not always encourage managers to pursue projects that are primarily characterized by idiosyncratic risk when projects with systematic risk are available as an alternative.","['Christopher S. Armstrong', 'Rahul Vashishtha']","['Executive compensation', 'Equity incentives', 'Risk-taking incentives', 'Systematic and idiosyncratic risk', 'Hedging']",[],April,https://www.sciencedirect.com//science/article/pii/S0304405X11002637,Journal of Financial Economics,2012,104,1
Expropriation risk and technology,This paper develops a unified framework to analyze the dynamics of firm investment in countries with poor legal enforcement. The firm's technology edge over the government generates endogenous property rights. Industry variation in the technology gap predicts a sectoral pecking-order of expropriations. Long-run investment distortions may be Pareto superior relative to persistent investment at the static optimum. The dynamics of investment and transfers depend on whether incentives (backloading) or efficiency (frontloading) concerns dominate at the initial division of surplus. An increase in government efficiency may reduce its welfare. The model provides a technology-driven rationale for the widespread use of conglomerate structures in emerging market countries.,['Marcus M. Opp'],"['Expropriation risk', 'Foreign direct investment', 'Dynamic contracting', 'Property rights', 'Self-enforcing contracts', 'Principal-agent models', 'Political risk']",[],January,https://www.sciencedirect.com//science/article/pii/S0304405X11001930,Journal of Financial Economics,2012,103,1
Competition and the cost of debt,"This paper empirically shows that the cost of bank debt is systematically higher for firms that operate in competitive product markets. Using various proxies for product market competition, and reductions of import tariff rates to capture exogenous changes to a firm's competitive environment, I find that competition has a significantly positive effect on the cost of bank debt. Moreover, the analysis reveals that the effect of competition is greater in industries in which small firms face financially strong rivals, in industries with intense strategic interactions between firms, and in illiquid industries. Overall, these findings suggest that banks price financial contracts by taking into account the risk that arises from product market competition.",['Philip Valta'],"['Product market competition', 'Import tariffs', 'Cost of debt', 'Bank loans']",[],September,https://www.sciencedirect.com//science/article/pii/S0304405X12000645,Journal of Financial Economics,2012,105,3
"U.S. stock market crash risk, 1926–2010","This paper examines how well alternate time-changed Lévy processes capture stochastic volatility and the substantial outliers observed in U.S. stock market returns over the past 85 years. The autocorrelation of daily stock market returns varies substantially over time, necessitating an additional state variable when analyzing historical data. I estimate various one- and two-factor stochastic volatility/Lévy models with time-varying autocorrelation via extensions of the Bates (2006) methodology that provide filtered daily estimates of volatility and autocorrelation. The paper explores option pricing implications, including for the Volatility Index (VIX) during the recent financial crisis.",['David S. Bates'],"['Lévy processes', 'Time-changed Lévy processes', 'Stock market crashes', 'Option pricing']",[],August,https://www.sciencedirect.com//science/article/pii/S0304405X12000414,Journal of Financial Economics,2012,105,2
"Entrepreneurial finance, credit cards, and race","This paper examines the impact of financial deregulation on entrepreneurship. We assess the impact of credit card deregulation on transitions into self-employment using state-level removal of credit card interest rate ceilings following the US Supreme Court's 1978 Marquette decision as a quasi-natural experiment. We find that credit card deregulation increases the probability of entrepreneurial entry, with a particularly strong effect for black entrepreneurs. We demonstrate that these effects are magnified in states with a history of racial discrimination and link the results to discrimination-based barriers to entry.","['Aaron K. Chatterji', 'Robert C. Seamans']","['Financial constraints', 'Entrepreneurship', 'Barriers to entry', 'Race']",[],October,https://www.sciencedirect.com//science/article/pii/S0304405X12000682,Journal of Financial Economics,2012,106,1
Bankruptcy spillover effects on strategic alliance partners,"This paper examines whether a party to a strategic alliance or joint venture suffers from spillover effects when the other partner files for bankruptcy. We find that the non-bankrupt strategic alliance partners, on average, experience a negative stock price reaction around their partner firm's bankruptcy filing announcement. This negative effect is strongest for longer partnerships and those with higher returns at the announcement of the initial alliance formation. Furthermore, horizontal alliance firms in declining industries have lower returns, indicating that industry conditions can exacerbate expected problems for the non-bankrupt firm. Non-bankrupt partners also experience drops in profit margins and investment levels in the subsequent two years with the worst performance concentrated among the longer-term agreements. There is very little impact on the returns or performance for joint venture partners, which suggests that these agreements are more insulating for the partner firm.","['Audra L. Boone', 'Vladimir I. Ivanov']","['Strategic alliance', 'Joint venture', 'Bankruptcy', 'Spillover effects']",[],March,https://www.sciencedirect.com//science/article/pii/S0304405X11002352,Journal of Financial Economics,2012,103,3
Stock returns after major price shocks: The impact of information,"This paper focuses on stocks that experience major price changes. Using analyst reports as a proxy, I find that price events accompanied by information are followed by drift, while no-information ones result in reversals. One interpretation of these results is that investors underreact to news about fundamentals and overreact to other shocks that move stock prices. Consistent with this hypothesis, information-based price changes are more strongly correlated with future earnings surprises than no-information ones. Furthermore, drift exists only when the direction of the price move and of the change in analyst recommendations have the same sign. Finally, the ratio of no-information to information-based price shocks is strongly correlated with aggregate implied volatility and also forecasts momentum returns.",['Pavel G. Savor'],"['Predictability of stock returns', 'Information', 'Analyst reports', 'Momentum reversals']",[],December,https://www.sciencedirect.com//science/article/pii/S0304405X12001377,Journal of Financial Economics,2012,106,3
